Sheet: Pressuregradient
A1: Average Turbine Efficiency / % | B1: 0.4 | C1: Use self-excitated! e.g. permanent magnets. #Generators = | D1: TODO: Use peak Voltage/Back EMF isntead of RMS voltage for bushless / 3phase. May depend on motor type? V/RPM | E1: Ri / ohm | F1: P_Nominal / W | G1: V_Nomin. / V | H1: Power Factor Motor plate or figure out, e.g. measure. | I1: Idle Current I_0 / A | J1: f / Hz | K1: R_L / ohm | L1: CC-BY-SA Licence (SA = share alike) | O1: UseW/%= | P1: of:=([.S44]/SUM([.B16:.Q16])) -> 0.0620964346035537 | Q1: Wind-E | R1: density_medium / kg/m^3= (e.g. 1.225 @ 0m height @15°C temp.) | S1: 1000 | T1: 1440 | U1: ← KV / rpm/V Revolutions/minute that are required to generate exactly 1V. | V1: Kt / Nm/A→ Torque constant, i.e. torque / 1A current. | W1: of:=1/[.T1] * VALUE(LEFT([.$A$20]; SEARCH(" "; [.$A$20]) - 1)) -> 0.0208333333333333 | X1: Hydro Power Calculator | AC1: By Electrodacus & Faerietree (J.R.I.B.-Wein) | AD1: INPUT FIELDS Only input data on cells with this color.
A2: Ratio V_Rotorarmtip / V_Wind Tip Speed Ratio (TSR) | B2: 0.9 | C2: 1 | D2: of:=[.G2]/[.T1] -> 0.263888888888889 | E2: 7.1 | F2: 3000 | G2: 380 | H2: 0.87 | I2: 0.9 | J2: 50 | K2: 7.1 | L2: Use, share, give credit! And share improvements with the planet.For a better world. | O2: UseT/%= | P2: of:=([.R44]/SUM([.B18:.Q18])) -> 0.146027224938197 | Q2: Turbine-E | R2: a_planet(r) / kg m/s^2= (e.g. 1.225 @ 0m height @15°C temp.) | S2: 9.81
A3: Area_Turbine_in_Wind / m = | B3: of:=1.5 * [.B4] -> 1.5 | C3: of:=[.$B$3] -> 1.5 | D3: of:=[.$B$3] -> 1.5 | E3: of:=[.$B$3] -> 1.5 | F3: of:=[.$B$3] -> 1.5 | G3: of:=[.$B$3] -> 1.5 | H3: of:=[.$B$3] -> 1.5 | I3: of:=[.$B$3] -> 1.5 | J3: of:=[.$B$3] -> 1.5 | K3: of:=[.$B$3] -> 1.5 | L3: of:=[.$B$3] -> 1.5 | M3: of:=[.$B$3] -> 1.5 | N3: of:=[.$B$3] -> 1.5 | O3: of:=[.$B$3] -> 1.5 | P3: of:=[.$B$3] -> 1.5 | Q3: of:=[.$B$3] -> 1.5 | R3: Is Vertical: | S3: 1 | T3: ← For vertical/crossflow/helical/... turbine, effective area = diameter * height. ← For horizontal turbine effective area = pi*r^2. Not respecting the propeller gaps.
A4: Diameter_Tip2Tip_Turbine /m = | B4: 1 | C4: of:=[.$B$4] -> 1 | D4: of:=[.$B$3] -> 1.5 | E4: of:=[.$B$3] -> 1.5 | F4: of:=[.$B$3] -> 1.5 | G4: of:=[.$B$3] -> 1.5 | H4: of:=[.$B$3] -> 1.5 | I4: of:=[.$B$3] -> 1.5 | J4: of:=[.$B$3] -> 1.5 | K4: of:=[.$B$3] -> 1.5 | L4: of:=[.$B$3] -> 1.5 | M4: of:=[.$B$3] -> 1.5 | N4: of:=[.$B$3] -> 1.5 | O4: of:=[.$B$3] -> 1.5 | P4: of:=[.$B$3] -> 1.5 | Q4: of:=[.$B$3] -> 1.5 | R4: V_Wind_ideal | S4: V_Wind_critical | T4: Note: TSR Tip speed ratio Depends on how much wind the turbine catches and transforms into kinetic energy, i.e.speed.
A5: Flow speed / m/s | B5: 1 | C5: 2 | D5: 3 | E5: 4 | F5: 5 | G5: 6 | H5: 7 | I5: 8 | J5: 9 | K5: 10 | L5: 11 | M5: 12 | N5: 13 | O5: 14 | P5: 15 | Q5: 16 | R5: of:=([.$B$4]*PI())/[.R19] / [.$B$2] -> 2.79252680319093 | S5: of:=([.$B$4]*PI())/[.S19] / [.$B$2] -> 3.07177948351002
A6: Head H_penstock_turbine / m (height difference water inlet – turbine contact point) | B6: 1 | C6: Delta-Pressure_head / Pa = | D6: of:=[.$B$6] * [.$B$7] *([.$S$1] * [.$S$2]) -> 1962 | E6: of:=CONCATENATE(ROUND([.E5] * 3.6; 2); "km/h") -> 14.4km/h | F6: of:=CONCATENATE(ROUND([.F5] * 3.6; 2); "km/h") -> 18km/h | G6: of:=CONCATENATE(ROUND([.G5] * 3.6; 2); "km/h") -> 21.6km/h | H6: of:=CONCATENATE(ROUND([.H5] * 3.6; 2); "km/h") -> 25.2km/h | I6: of:=CONCATENATE(ROUND([.I5] * 3.6; 2); "km/h") -> 28.8km/h | J6: of:=CONCATENATE(ROUND([.J5] * 3.6; 2); "km/h") -> 32.4km/h | K6: of:=CONCATENATE(ROUND([.K5] * 3.6; 2); "km/h") -> 36km/h | L6: of:=CONCATENATE(ROUND([.L5] * 3.6; 2); "km/h") -> 39.6km/h | M6: of:=CONCATENATE(ROUND([.M5] * 3.6; 2); "km/h") -> 43.2km/h | N6: of:=CONCATENATE(ROUND([.N5] * 3.6; 2); "km/h") -> 46.8km/h | O6: of:=CONCATENATE(ROUND([.O5] * 3.6; 2); "km/h") -> 50.4km/h | P6: of:=CONCATENATE(ROUND([.P5] * 3.6; 2); "km/h") -> 54km/h | Q6: of:=CONCATENATE(ROUND([.Q5] * 3.6; 2); "km/h") -> 57.6km/h | R6: of:=CONCATENATE(ROUND([.R5] * 3.6; 2); "km/h") -> 10.05km/h | S6: of:=CONCATENATE(ROUND([.S5] * 3.6; 2); "km/h") -> 11.06km/h
A7: Flow rate Q_Turbine / m^3/s = | B7: 0.2 | C7: of:=[.$B$7] -> 0.2 | D7: of:=[.$B$7] -> 0.2 | E7: of:=[.$B$7] -> 0.2 | F7: of:=[.$B$7] -> 0.2 | G7: of:=[.$B$7] -> 0.2 | H7: of:=[.$B$7] -> 0.2 | I7: of:=[.$B$7] -> 0.2 | J7: of:=[.$B$7] -> 0.2 | K7: of:=[.$B$7] -> 0.2 | L7: of:=[.$B$7] -> 0.2 | M7: of:=[.$B$7] -> 0.2 | N7: of:=[.$B$7] -> 0.2 | O7: of:=[.$B$7] -> 0.2 | P7: of:=[.$B$7] -> 0.2 | Q7: of:=[.$B$7] -> 0.2 | R7: of:=[.$B$7] -> 0.2 | S7: of:=[.$B$7] -> 0.2
A9: Pipe roughness constant C = Material and age, fonte-cast iron=100; acier,cuivre-steel,cooper=120; PE,PVC=150 | B9: 120 | C9: Length_pipe / m = | D9: 10 | E9: Diam._pipe / m = | F9: 0.1 | R9: ← Penstock (if exists)
A10: Delta Pressure (Piping Losses)_head / Pa = =; Pressure of height difference. | B10: of:=6.05 * (([.$C$7]*1000)^1.85 * 10^8) / ([.$B$9]^1.85 * ([.$F$9]*1000)^4.87) * 100000 / 1000 -> 28.3253680368831 | C10: Efficiency c_p = Density * Flow_rate * c_vortex * w = Pmech / Phydro = g*density * Flow_rate * Height_difference
A11: Delta Pressure (remaining)_head / Pa = =; Pressure of height difference. | B11: of:=[.$D$6] - [.B10] -> 1933.67463196312 | J11: m/s^2 Kg/m^3 m^3/s m = m/s^2 Kg/s m = Kg m^2 / s^3 = J/s = W | S11: dm = density * dV | U11: dV = flow_rate * dt
A12: Power_head,flow / W | B12: of:=[.$B$6]*[.B$7]*[.$S$2]*[.$S$1] -> 1962 | C12: of:=[.$B$6]*[.C$7]*[.$S$2]*[.$S$1] -> 1962 | D12: of:=[.$B$6]*[.D$7]*[.$S$2]*[.$S$1] -> 1962 | E12: of:=[.$B$6]*[.E$7]*[.$S$2]*[.$S$1] -> 1962 | F12: of:=[.$B$6]*[.F$7]*[.$S$2]*[.$S$1] -> 1962 | G12: of:=[.$B$6]*[.G$7]*[.$S$2]*[.$S$1] -> 1962 | H12: of:=[.$B$6]*[.H$7]*[.$S$2]*[.$S$1] -> 1962 | I12: of:=[.$B$6]*[.I$7]*[.$S$2]*[.$S$1] -> 1962 | J12: of:=[.$B$6]*[.J$7]*[.$S$2]*[.$S$1] -> 1962 | K12: of:=[.$B$6]*[.K$7]*[.$S$2]*[.$S$1] -> 1962 | L12: of:=[.$B$6]*[.L$7]*[.$S$2]*[.$S$1] -> 1962 | M12: of:=[.$B$6]*[.M$7]*[.$S$2]*[.$S$1] -> 1962 | N12: of:=[.$B$6]*[.N$7]*[.$S$2]*[.$S$1] -> 1962 | O12: of:=[.$B$6]*[.O$7]*[.$S$2]*[.$S$1] -> 1962 | P12: of:=[.$B$6]*[.P$7]*[.$S$2]*[.$S$1] -> 1962 | Q12: of:=[.$B$6]*[.Q$7]*[.$S$2]*[.$S$1] -> 1962 | R12: E_pot = ∫ (g h) dm = g h ∫ density dV = g h density ∫ flow_rate dt = g h density flow_rate 0..t'∫ dt = g h density flow_rate (t + const – (0 + const)) = g h density flow_rate t
A13: Δheight Energy / Wh/d | B13: of:= [.$B$12] * 24 -> 47088 | C13: of:=24 * [.C12] * [.C$15] -> 2934.3781872 | D13: of:=60 * 60 * 24 * [.D$12] * [.D$15] -> 19218628.1664 | E13: of:=24 * [.E12] * [.E$15] -> 6535.531872 | F13: of:=24 * [.F12] * [.F$15] -> 6587.6112 | G13: of:=24 * [.G12] * [.G$15] -> 6421.013856 | H13: of:=24 * [.H12] * [.H$15] -> 4806.790128 | I13: of:=24 * [.I12] * [.I$15] -> 4362.7691232 | J13: of:=24 * [.J12] * [.J$15] -> 2914.2574848 | K13: of:=24 * [.K12] * [.K$15] -> 1574.9664624 | L13: of:=24 * [.L12] * [.L$15] -> 1448.5069296 | M13: of:=24 * [.M12] * [.M$15] -> 1294.7457744 | N13: of:=24 * [.N12] * [.N$15] -> 551.8148544 | O13: of:=24 * [.O12] * [.O$15] -> 514.4505264 | P13: of:=24 * [.P12] * [.P$15] -> 173.87856144 | Q13: of:=24 * [.Q12] * [.Q$15] -> 236.55504384
A14: Power_medium_flow / W = | B14: of:=0.5*[.$S$1]*([.B3])*([.B5]^3) -> 750 | C14: of:=0.5*[.$S$1]*([.C7])*([.C5]^3) -> 800 | D14: of:=0.5*[.$S$1]*([.D7])*([.D5]^3) -> 2700 | E14: of:=0.5*[.$S$1]*([.E7])*([.E5]^3) -> 6400 | F14: of:=0.5*[.$S$1]*([.F7])*([.F5]^3) -> 12500 | G14: of:=0.5*[.$S$1]*([.G7])*([.G5]^3) -> 21600 | H14: of:=0.5*[.$S$1]*([.H7])*([.H5]^3) -> 34300 | I14: of:=0.5*[.$S$1]*([.I7])*([.I5]^3) -> 51200 | J14: of:=0.5*[.$S$1]*([.J7])*([.J5]^3) -> 72900 | K14: of:=0.5*[.$S$1]*([.K7])*([.K5]^3) -> 100000 | L14: of:=0.5*[.$S$1]*([.L7])*([.L5]^3) -> 133100 | M14: of:=0.5*[.$S$1]*([.M7])*([.M5]^3) -> 172800 | N14: of:=0.5*[.$S$1]*([.N7])*([.N5]^3) -> 219700 | O14: of:=0.5*[.$S$1]*([.O7])*([.O5]^3) -> 274400 | P14: of:=0.5*[.$S$1]*([.P7])*([.P5]^3) -> 337500 | Q14: of:=0.5*[.$S$1]*([.Q7])*([.Q5]^3) -> 409600
A15: of:=CONCATENATE("Day-Flow-Distrib. (=>"; ROUND([.B15]*[.B5] + [.C15]*[.C5] + [.D15]*[.D5] + [.E15]*[.E5] + [.F15]*[.F5] + [.G15]*[.G5] + [.H15]*[.H5]+ [.I15]*[.I5]+ [.J15]*[.J5] + [.K15]*[.K5] + [.L15]*[.L5] + [.M15]*[.M5] + [.N15]*[.N5] + [.O15]*[.O5] + [.P15]*[.P5] + [.Q15]*[.Q5]; 1); "m/s)") -> Day-Flow-Distrib. (=>6m/s) | B15: of:=0.014 -> 0.014 | C15: of:=0.0623169 -> 0.0623169 | D15: of:=0.113373 -> 0.113373 | E15: of:=0.138794 -> 0.138794 | F15: of:=0.1399 -> 0.1399 | G15: of:=0.136362 -> 0.136362 | H15: of:=0.102081 -> 0.102081 | I15: of:=0.0926514 -> 0.0926514 | J15: of:=0.0618896 -> 0.0618896 | K15: of:=0.0334473 -> 0.0334473 | L15: of:=0.0307617 -> 0.0307617 | M15: of:=0.0274963 -> 0.0274963 | N15: of:=0.0117188 -> 0.0117188 | O15: of:=0.0109253 -> 0.0109253 | P15: of:=0.00369263 -> 0.00369263 | Q15: of:=0.00502368 -> 0.00502368 | R15: of:=CONCATENATE(" = "; ROUND(SUM([.B15:.Q15]); 4) * 100; "%") ->  = 98.44% | S15: ← Total Wind % / 24h
A16: Flow Energy / Wh/d | B16: of:=24 * [.B15] * [.B14] -> 252 | C16: of:=24 * [.C15] * [.C14] -> 1196.48448 | D16: of:=24 * [.D15] * [.D14] -> 7346.5704 | E16: of:=24 * [.E15] * [.E14] -> 21318.7584 | F16: of:=24 * [.F15] * [.F14] -> 41970 | G16: of:=24 * [.G15] * [.G14] -> 70690.0608 | H16: of:=24 * [.H15] * [.H14] -> 84033.0792 | I16: of:=24 * [.I15] * [.I14] -> 113850.04032 | J16: of:=24 * [.J15] * [.J14] -> 108282.04416 | K16: of:=24 * [.K15] * [.K14] -> 80273.52 | L16: of:=24 * [.L15] * [.L14] -> 98265.17448 | M16: of:=24 * [.M15] * [.M14] -> 114032.65536 | N16: of:=24 * [.N15] * [.N14] -> 61790.88864 | O16: of:=24 * [.O15] * [.O14] -> 71949.65568 | P16: of:=24 * [.P15] * [.P14] -> 29910.303 | Q16: of:=24 * [.Q15] * [.Q14] -> 49384.783872
A17: Turbine Power / W | B17: of:=[.B14]*[.$B$1] -> 300 | C17: of:=[.C14]*[.$B$1] -> 320 | D17: of:=[.D14]*[.$B$1] -> 1080 | E17: of:=[.E14]*[.$B$1] -> 2560 | F17: of:=[.F14]*[.$B$1] -> 5000 | G17: of:=[.G14]*[.$B$1] -> 8640 | H17: of:=[.H14]*[.$B$1] -> 13720 | I17: of:=[.I14]*[.$B$1] -> 20480 | J17: of:=[.J14]*[.$B$1] -> 29160 | K17: of:=[.K14]*[.$B$1] -> 40000 | L17: of:=[.L14]*[.$B$1] -> 53240 | M17: of:=[.M14]*[.$B$1] -> 69120 | N17: of:=[.N14]*[.$B$1] -> 87880 | O17: of:=[.O14]*[.$B$1] -> 109760 | P17: of:=[.P14]*[.$B$1] -> 135000 | Q17: of:=[.Q14]*[.$B$1] -> 163840
A18: Turbine Energy / Wh/d | B18: of:=24 * [.B15] * [.B17] -> 100.8 | C18: of:=24 * [.C15] * [.C17] -> 478.593792 | D18: of:=24 * [.D15] * [.D17] -> 2938.62816 | E18: of:=24 * [.E15] * [.E17] -> 8527.50336 | F18: of:=24 * [.F15] * [.F17] -> 16788 | G18: of:=24 * [.G15] * [.G17] -> 28276.02432 | H18: of:=24 * [.H15] * [.H17] -> 33613.23168 | I18: of:=24 * [.I15] * [.I17] -> 45540.016128 | J18: of:=24 * [.J15] * [.J17] -> 43312.817664 | K18: of:=24 * [.K15] * [.K17] -> 32109.408 | L18: of:=24 * [.L15] * [.L17] -> 39306.069792 | M18: of:=24 * [.M15] * [.M17] -> 45613.062144 | N18: of:=24 * [.N15] * [.N17] -> 24716.355456 | O18: of:=24 * [.O15] * [.O17] -> 28779.862272 | P18: of:=24 * [.P15] * [.P17] -> 11964.1212 | Q18: of:=24 * [.Q15] * [.Q17] -> 19753.9135488
A19: T_period_turbine / s (time/revolution) | B19: of:=IF([.$S$3]>0;(2*[.B4]/2*PI())/([.B5] * [.$B$2]);"TODO") -> 3.49065850398866 | C19: of:=(2*[.C4]/2*PI())/([.C5] * [.$B$2]) -> 1.74532925199433 | D19: of:=(2*[.D4]/2*PI())/([.D5] * [.$B$2]) -> 1.74532925199433 | E19: of:=(2*[.E4]/2*PI())/([.E5] * [.$B$2]) -> 1.30899693899575 | F19: of:=(2*[.F4]/2*PI())/([.F5] * [.$B$2]) -> 1.0471975511966 | G19: of:=(2*[.G4]/2*PI())/([.G5] * [.$B$2]) -> 0.872664625997165 | H19: of:=(2*[.H4]/2*PI())/([.H5] * [.$B$2]) -> 0.747998250854713 | I19: of:=(2*[.I4]/2*PI())/([.I5] * [.$B$2]) -> 0.654498469497874 | J19: of:=(2*[.J4]/2*PI())/([.J5] * [.$B$2]) -> 0.581776417331443 | K19: of:=(2*[.K4]/2*PI())/([.K5] * [.$B$2]) -> 0.523598775598299 | L19: of:=(2*[.L4]/2*PI())/([.L5] * [.$B$2]) -> 0.475998886907544 | M19: of:=(2*[.M4]/2*PI())/([.M5] * [.$B$2]) -> 0.436332312998582 | N19: of:=(2*[.N4]/2*PI())/([.N5] * [.$B$2]) -> 0.402768288921768 | O19: of:=(2*[.O4]/2*PI())/([.O5] * [.$B$2]) -> 0.373999125427356 | P19: of:=(2*[.P4]/2*PI())/([.P5] * [.$B$2]) -> 0.349065850398866 | Q19: of:=([.Q4]*PI())/([.Q5] * [.$B$2]) -> 0.327249234748937 | R19: of:=60/[.R20] -> 1.25 | S19: of:=60/[.S20] -> 1.13636363636364 | T19: ← Needs horizontal boolean info! Because if it's a horizontal turbine, then there's need to calculate T_period differently.
A20: of:=CONCATENATE(30; "  ←Ratio Transm.Gen./Turb. | @1:1→") -> 30  ←Ratio Transm.Gen./Turb. | @1:1→ | B20: of:=60/[.B19] -> 17.1887338539247 | C20: of:=60/[.C19] -> 34.3774677078494 | D20: of:=60/[.D19] -> 34.3774677078494 | E20: of:=60/[.E19] -> 45.8366236104659 | F20: of:=60/[.F19] -> 57.2957795130823 | G20: of:=60/[.G19] -> 68.7549354156988 | H20: of:=60/[.H19] -> 80.2140913183152 | I20: of:=60/[.I19] -> 91.6732472209317 | J20: of:=60/[.J19] -> 103.132403123548 | K20: of:=60/[.K19] -> 114.591559026165 | L20: of:=60/[.L19] -> 126.050714928781 | M20: of:=60/[.M19] -> 137.509870831398 | N20: of:=60/[.N19] -> 148.969026734014 | O20: of:=60/[.O19] -> 160.42818263663 | P20: of:=60/[.P19] -> 171.887338539247 | Q20: of:=60/[.Q19] -> 183.346494441863 | R20: of:=[.R21] / VALUE(LEFT([.$A$20]; SEARCH(" "; [.$A$20]) - 1)) -> 48 | S20: of:=[.S21] / VALUE(LEFT([.$A$20]; SEARCH(" "; [.$A$20]) - 1)) -> 52.8
A21: Generator Revolutio/min (rpm) | B21: of:=[.B20]* VALUE(LEFT([.$A$20]; SEARCH(" "; [.$A$20]) - 1)) -> 515.662015617741 | C21: of:=[.C20]* VALUE(LEFT([.$A$20]; SEARCH(" "; [.$A$20]) - 1)) -> 1031.32403123548 | D21: of:=[.D20]* VALUE(LEFT([.$A$20]; SEARCH(" "; [.$A$20]) - 1)) -> 1031.32403123548 | E21: of:=[.E20]* VALUE(LEFT([.$A$20]; SEARCH(" "; [.$A$20]) - 1)) -> 1375.09870831398 | F21: of:=[.F20]* VALUE(LEFT([.$A$20]; SEARCH(" "; [.$A$20]) - 1)) -> 1718.87338539247 | G21: of:=[.G20]* VALUE(LEFT([.$A$20]; SEARCH(" "; [.$A$20]) - 1)) -> 2062.64806247096 | H21: of:=[.H20]* VALUE(LEFT([.$A$20]; SEARCH(" "; [.$A$20]) - 1)) -> 2406.42273954946 | I21: of:=[.I20]* VALUE(LEFT([.$A$20]; SEARCH(" "; [.$A$20]) - 1)) -> 2750.19741662795 | J21: of:=[.J20]* VALUE(LEFT([.$A$20]; SEARCH(" "; [.$A$20]) - 1)) -> 3093.97209370645 | K21: of:=[.K20]* VALUE(LEFT([.$A$20]; SEARCH(" "; [.$A$20]) - 1)) -> 3437.74677078494 | L21: of:=[.L20]* VALUE(LEFT([.$A$20]; SEARCH(" "; [.$A$20]) - 1)) -> 3781.52144786343 | M21: of:=[.M20]* VALUE(LEFT([.$A$20]; SEARCH(" "; [.$A$20]) - 1)) -> 4125.29612494193 | N21: of:=[.N20]* VALUE(LEFT([.$A$20]; SEARCH(" "; [.$A$20]) - 1)) -> 4469.07080202042 | O21: of:=[.O20]* VALUE(LEFT([.$A$20]; SEARCH(" "; [.$A$20]) - 1)) -> 4812.84547909891 | P21: of:=[.P20]* VALUE(LEFT([.$A$20]; SEARCH(" "; [.$A$20]) - 1)) -> 5156.62015617741 | Q21: of:=[.Q20]* VALUE(LEFT([.$A$20]; SEARCH(" "; [.$A$20]) - 1)) -> 5500.3948332559 | R21: of:=([.R22] / [.$D$2]) -> 1440 | S21: of:=([.S22] / [.$D$2]) -> 1584
A22: Voltage_RMS @xRPM / V | B22: of:=IF([.$J$2]>0; [.B21]*[.$D$2] * 1 / SQRT(2); [.B21]*[.$D$2]) -> 96.2213062892907 | C22: of:=IF([.$J$2]>0; [.C21]*[.$D$2] * 1 / SQRT(2); [.C21]*[.$D$2]) -> 192.442612578581 | D22: of:=IF([.$J$2]>0; [.D21]*[.$D$2] * 1 / SQRT(2); [.D21]*[.$D$2]) -> 192.442612578581 | E22: of:=IF([.$J$2]>0; [.E21]*[.$D$2] * 1 / SQRT(2); [.E21]*[.$D$2]) -> 256.590150104775 | F22: of:=IF([.$J$2]>0; [.F21]*[.$D$2] * 1 / SQRT(2); [.F21]*[.$D$2]) -> 320.737687630969 | G22: of:=IF([.$J$2]>0; [.G21]*[.$D$2] * 1 / SQRT(2); [.G21]*[.$D$2]) -> 384.885225157163 | H22: of:=IF([.$J$2]>0; [.H21]*[.$D$2] * 1 / SQRT(2); [.H21]*[.$D$2]) -> 449.032762683357 | I22: of:=IF([.$J$2]>0; [.I21]*[.$D$2] * 1 / SQRT(2); [.I21]*[.$D$2]) -> 513.180300209551 | J22: of:=IF([.$J$2]>0; [.J21]*[.$D$2] * 1 / SQRT(2); [.J21]*[.$D$2]) -> 577.327837735744 | K22: of:=IF([.$J$2]>0; [.K21]*[.$D$2] * 1 / SQRT(2); [.K21]*[.$D$2]) -> 641.475375261938 | L22: of:=IF([.$J$2]>0; [.L21]*[.$D$2] * 1 / SQRT(2); [.L21]*[.$D$2]) -> 705.622912788132 | M22: of:=IF([.$J$2]>0; [.M21]*[.$D$2] * 1 / SQRT(2); [.M21]*[.$D$2]) -> 769.770450314326 | N22: of:=IF([.$J$2]>0; [.N21]*[.$D$2] * 1 / SQRT(2); [.N21]*[.$D$2]) -> 833.91798784052 | O22: of:=IF([.$J$2]>0; [.O21]*[.$D$2] * 1 / SQRT(2); [.O21]*[.$D$2]) -> 898.065525366713 | P22: of:=IF([.$J$2]>0; [.P21]*[.$D$2] * 1 / SQRT(2); [.P21]*[.$D$2]) -> 962.213062892907 | Q22: of:=IF([.$J$2]>0; [.Q21]*[.$D$2] * 1 / SQRT(2); [.Q21]*[.$D$2]) -> 1026.3606004191 | R22: of:=[.G2] -> 380 | S22: of:=[.G2] + ([.G2] * 0.1) -> 418 | T22: ← V_still_safe_to_operate_generate_at = V_Nominal/Design + delta V_margin
A23: I_actual / Ampère ← wrong!? It's AC. TODO Include power factor and figure proper formula, include RMS, sqrt(3)? | B23: of:=[.B$22]/[.$E$2] -> 13.5522966604635 | C23: of:=[.C$22]/[.$E$2] -> 27.104593320927 | D23: of:=[.D$22]/[.$E$2] -> 27.104593320927 | E23: of:=[.E$22]/[.$E$2] -> 36.139457761236 | F23: of:=[.F$22]/[.$E$2] -> 45.1743222015449 | G23: of:=[.G$22]/[.$E$2] -> 54.2091866418539 | H23: of:=[.H$22]/[.$E$2] -> 63.2440510821629 | I23: of:=[.I$22]/[.$E$2] -> 72.2789155224719 | J23: of:=[.J$22]/[.$E$2] -> 81.3137799627809 | K23: of:=[.K$22]/[.$E$2] -> 90.3486444030899 | L23: of:=[.L$22]/[.$E$2] -> 99.3835088433989 | M23: of:=[.M$22]/[.$E$2] -> 108.418373283708 | N23: of:=[.N$22]/[.$E$2] -> 117.453237724017 | O23: of:=[.O$22]/[.$E$2] -> 126.488102164326 | P23: of:=[.P$22]/[.$E$2] -> 135.522966604635 | Q23: of:=[.Q$22]/[.$E$2] -> 144.557831044944 | R23: of:=[.R22]/[.$E$2] -> 53.5211267605634 | S23: of:=[.S22]/[.$E$2] -> 58.8732394366197
A25: Torque / Nm | B25: of:=[.$W$1] * [.B23] -> 0.282339513759656 | C25: of:=[.$W$1] * [.C23] -> 0.564679027519312 | D25: of:=[.$W$1] * [.D23] -> 0.564679027519312 | E25: of:=[.$W$1] * [.E23] -> 0.752905370025749 | F25: of:=[.$W$1] * [.F23] -> 0.941131712532186 | G25: of:=[.$W$1] * [.G23] -> 1.12935805503862 | H25: of:=[.$W$1] * [.H23] -> 1.31758439754506 | I25: of:=[.$W$1] * [.I23] -> 1.5058107400515 | J25: of:=[.$W$1] * [.J23] -> 1.69403708255794 | K25: of:=[.$W$1] * [.K23] -> 1.88226342506437 | L25: of:=[.$W$1] * [.L23] -> 2.07048976757081 | M25: of:=[.$W$1] * [.M23] -> 2.25871611007725 | N25: of:=[.$W$1] * [.N23] -> 2.44694245258368 | O25: of:=[.$W$1] * [.O23] -> 2.63516879509012 | P25: of:=[.$W$1] * [.P23] -> 2.82339513759656 | Q25: of:=[.$W$1] * [.Q23] -> 3.011621480103 | R25: of:=[.$W$1] * [.R23] -> 1.1150234741784 | S25: of:=[.$W$1] * [.S23] -> 1.22652582159624
A26: Generator Efficiency eta_max = | B26: of:=(1 - SQRT([.$I$2]*[.$E$2]/[.B22]))^2 -> 0.551008949733969 | C26: of:=(1 - SQRT([.$I$2]*[.$E$2]/[.C22]))^2 -> 0.668761544906871 | D26: of:=(1 - SQRT([.$I$2]*[.$E$2]/[.D22]))^2 -> 0.668761544906871 | E26: of:=(1 - SQRT([.$I$2]*[.$E$2]/[.E22]))^2 -> 0.709286493982456 | F26: of:=(1 - SQRT([.$I$2]*[.$E$2]/[.F22]))^2 -> 0.737626365227421 | G26: of:=(1 - SQRT([.$I$2]*[.$E$2]/[.G22]))^2 -> 0.758902122834919 | H26: of:=(1 - SQRT([.$I$2]*[.$E$2]/[.H22]))^2 -> 0.775646535549344 | I26: of:=(1 - SQRT([.$I$2]*[.$E$2]/[.I22]))^2 -> 0.789276818978248 | J26: of:=(1 - SQRT([.$I$2]*[.$E$2]/[.J22]))^2 -> 0.800656878644282 | K26: of:=(1 - SQRT([.$I$2]*[.$E$2]/[.K22]))^2 -> 0.810347672020363 | L26: of:=(1 - SQRT([.$I$2]*[.$E$2]/[.L22]))^2 -> 0.818731595755571 | M26: of:=(1 - SQRT([.$I$2]*[.$E$2]/[.M22]))^2 -> 0.826079596437403 | N26: of:=(1 - SQRT([.$I$2]*[.$E$2]/[.N22]))^2 -> 0.832589793286563 | O26: of:=(1 - SQRT([.$I$2]*[.$E$2]/[.O22]))^2 -> 0.838410892741829 | P26: of:=(1 - SQRT([.$I$2]*[.$E$2]/[.P22]))^2 -> 0.843657005250745 | Q26: of:=(1 - SQRT([.$I$2]*[.$E$2]/[.Q22]))^2 -> 0.848417364979203 | R26: P_ohmic_loss @constant power NOT THE CASE HERE!. | S26: Formula only works if Power is kept constant as then U_0 can be factored in. Else losses just depend on current, see below. | T26: of:= [.C$37] / [.$G$2] / [.$G$2] -> 0 | U26: P_loss = P_0 / U_0^2 not working here due to power not being kept constant!?
A27: Generator P_ohmic_loss (@high current, load dependent) | B27: of:=[.$E$2] * [.B23] * [.B23] -> 1304.01968788979 | C27: of:=[.$E$2] * [.C23] * [.C23] -> 5216.07875155915 | D27: of:=[.$E$2] * [.D23] * [.D23] -> 5216.07875155916 | E27: of:=[.$E$2] * [.E23] * [.E23] -> 9273.02889166072 | F27: of:=[.$E$2] * [.F23] * [.F23] -> 14489.1076432199 | G27: of:=[.$E$2] * [.G23] * [.G23] -> 20864.3150062366 | H27: of:=[.$E$2] * [.H23] * [.H23] -> 28398.6509807109 | I27: of:=[.$E$2] * [.I23] * [.I23] -> 37092.1155666429 | J27: of:=[.$E$2] * [.J23] * [.J23] -> 46944.7087640324 | K27: of:=[.$E$2] * [.K23] * [.K23] -> 57956.4305728795 | L27: of:=[.$E$2] * [.L23] * [.L23] -> 70127.2809931842 | M27: of:=[.$E$2] * [.M23] * [.M23] -> 83457.2600249465 | N27: of:=[.$E$2] * [.N23] * [.N23] -> 97946.3676681664 | O27: of:=[.$E$2] * [.O23] * [.O23] -> 113594.603922844 | P27: of:=[.$E$2] * [.P23] * [.P23] -> 130401.968788979 | Q27: of:=[.$E$2] * [.Q23] * [.Q23] -> 148368.462266572 | R27: of:=[.$E$2] * [.R23] * [.R23] -> 20338.0281690141 | S27: of:=[.$E$2] * [.S23] * [.S23] -> 24609.014084507
A28: Generator P_iron_loss if iron core (@I_0, i.e. low current, often at low speed, load independent) | B28: of:=[.B22]*[.$I$2] -> 86.5991756603616 | C28: of:=[.C22]*[.$I$2] -> 173.198351320723 | D28: of:=[.D22]*[.$I$2] -> 173.198351320723 | E28: of:=[.E22]*[.$I$2] -> 230.931135094298 | F28: of:=[.F22]*[.$I$2] -> 288.663918867872 | G28: of:=[.G22]*[.$I$2] -> 346.396702641447 | H28: of:=[.H22]*[.$I$2] -> 404.129486415021 | I28: of:=[.I22]*[.$I$2] -> 461.862270188596 | J28: of:=[.J22]*[.$I$2] -> 519.59505396217 | K28: of:=[.K22]*[.$I$2] -> 577.327837735744 | L28: of:=[.L22]*[.$I$2] -> 635.060621509319 | M28: of:=[.M22]*[.$I$2] -> 692.793405282893 | N28: of:=[.N22]*[.$I$2] -> 750.526189056468 | O28: of:=[.O22]*[.$I$2] -> 808.258972830042 | P28: of:=[.P22]*[.$I$2] -> 865.991756603616 | Q28: of:=[.Q22]*[.$I$2] -> 923.724540377191 | T28: of:=CONCATENATE("=>  Due to i_0 also pulling efficiency to zero at low currents while r_i pulls down"; CHAR(10);" at high currents, the peak efficiency will be inbetween (see eta_max above).") -> =>  Due to i_0 also pulling efficiency to zero at low currents while r_i pulls down
 at high currents, the peak efficiency will be inbetween (see eta_max above).
A29: P_Generator/P_Nominal | B29: of:=[.B$22] * [.B$23] / [.$F$2] -> 0.434673229296596 | C29: of:=[.C$22] * [.C$23] / [.$F$2] -> 1.73869291718638 | D29: of:=[.D$22] * [.D$23] / [.$F$2] -> 1.73869291718639 | E29: of:=[.E$22] * [.E$23] / [.$F$2] -> 3.09100963055357 | F29: of:=[.F$22] * [.F$23] / [.$F$2] -> 4.82970254773996 | G29: of:=[.G$22] * [.G$23] / [.$F$2] -> 6.95477166874554 | H29: of:=[.H$22] * [.H$23] / [.$F$2] -> 9.46621699357031 | I29: of:=[.I$22] * [.I$23] / [.$F$2] -> 12.3640385222143 | J29: of:=[.J$22] * [.J$23] / [.$F$2] -> 15.6482362546775 | K29: of:=[.K$22] * [.K$23] / [.$F$2] -> 19.3188101909598 | L29: of:=[.L$22] * [.L$23] / [.$F$2] -> 23.3757603310614 | M29: of:=[.M$22] * [.M$23] / [.$F$2] -> 27.8190866749822 | N29: of:=[.N$22] * [.N$23] / [.$F$2] -> 32.6487892227221 | O29: of:=[.O$22] * [.O$23] / [.$F$2] -> 37.8648679742813 | P29: of:=[.P$22] * [.P$23] / [.$F$2] -> 43.4673229296596 | Q29: of:=[.Q$22] * [.Q$23] / [.$F$2] -> 49.4561540888572 | T29: ← Auslastung / Generator capacity usage. Red is only tolerable to a certain degree. At some point the mechanic will break, even if the rotor is electrically/mechanically deccelerated to not go over the rated RPM.
A30: P_Gen._time_averaged / W | B30: of:=IF([.B$22] * [.B$23]  * [.$H$2]>[.$F$2]; [.$F$2]; [.B$22] * [.B$23]  * [.$H$2]) -> 1134.49712846412 | C30: of:=IF([.C$22] * [.C$23]  * [.$H$2]>[.$F$2]; [.$F$2]; [.C$22] * [.C$23]  * [.$H$2]) -> 3000 | D30: of:=IF([.D$22] * [.D$23]  * [.$H$2]>[.$F$2]; [.$F$2]; [.D$22] * [.D$23]  * [.$H$2]) -> 3000 | E30: of:=IF([.E$22] * [.E$23]  * [.$H$2]>[.$F$2]; [.$F$2]; [.E$22] * [.E$23]  * [.$H$2]) -> 3000 | F30: of:=IF([.F$22] * [.F$23]  * [.$H$2]>[.$F$2]; [.$F$2]; [.F$22] * [.F$23]  * [.$H$2]) -> 3000 | G30: of:=IF([.G$22] * [.G$23]  * [.$H$2]>[.$F$2]; [.$F$2]; [.G$22] * [.G$23]  * [.$H$2]) -> 3000 | H30: of:=IF([.H$22] * [.H$23]  * [.$H$2]>[.$F$2]; [.$F$2]; [.H$22] * [.H$23]  * [.$H$2]) -> 3000 | I30: of:=IF([.I$22] * [.I$23]  * [.$H$2]>[.$F$2]; [.$F$2]; [.I$22] * [.I$23]  * [.$H$2]) -> 3000 | J30: of:=IF([.J$22] * [.J$23]  * [.$H$2]>[.$F$2]; [.$F$2]; [.J$22] * [.J$23]  * [.$H$2]) -> 3000 | K30: of:=IF([.K$22] * [.K$23]  * [.$H$2]>[.$F$2]; [.$F$2]; [.K$22] * [.K$23]  * [.$H$2]) -> 3000 | L30: of:=IF([.L$22] * [.L$23]  * [.$H$2]>[.$F$2]; [.$F$2]; [.L$22] * [.L$23]  * [.$H$2]) -> 3000 | M30: of:=IF([.M$22] * [.M$23]  * [.$H$2]>[.$F$2]; [.$F$2]; [.M$22] * [.M$23]  * [.$H$2]) -> 3000 | N30: of:=IF([.N$22] * [.N$23]  * [.$H$2]>[.$F$2]; [.$F$2]; [.N$22] * [.N$23]  * [.$H$2]) -> 3000 | O30: of:=IF([.O$22] * [.O$23]  * [.$H$2]>[.$F$2]; [.$F$2]; [.O$22] * [.O$23]  * [.$H$2]) -> 3000 | P30: of:=IF([.P$22] * [.P$23]  * [.$H$2]>[.$F$2]; [.$F$2]; [.P$22] * [.P$23]  * [.$H$2]) -> 3000 | Q30: of:=IF([.Q$22] * [.Q$23]  * [.$H$2]>[.$F$2]; [.$F$2]; [.Q$22] * [.Q$23]  * [.$H$2]) -> 3000 | T30: ← Assumes the generator is prevented to generate more than its design power. (see red alert background in the power / power_nominal ratio above)
A31: P_All Generators / W | B31: of:=[.B30] * [.$C$2] -> 1134.49712846412 | C31: of:=[.C30] * [.$C$2] -> 3000 | D31: of:=[.D30] * [.$C$2] -> 3000 | E31: of:=[.E30] * [.$C$2] -> 3000 | F31: of:=[.F30] * [.$C$2] -> 3000 | G31: of:=[.G30] * [.$C$2] -> 3000 | H31: of:=[.H30] * [.$C$2] -> 3000 | I31: of:=[.I30] * [.$C$2] -> 3000 | J31: of:=[.J30] * [.$C$2] -> 3000 | K31: of:=[.K30] * [.$C$2] -> 3000 | L31: of:=[.L30] * [.$C$2] -> 3000 | M31: of:=[.M30] * [.$C$2] -> 3000 | N31: of:=[.N30] * [.$C$2] -> 3000 | O31: of:=[.O30] * [.$C$2] -> 3000 | P31: of:=[.P30] * [.$C$2] -> 3000 | Q31: of:=[.Q30] * [.$C$2] -> 3000 | R31: Gen.Tolerated Min.Efficiency:
A32: Output Power / W | B32: of:=IF([.B17]<[.B31];[.B17];[.B31]) -> 300 | C32: of:=IF([.C17]<[.C31];[.C17];[.C31]) -> 320 | D32: of:=IF([.D17]<[.D31];[.D17];[.D31]) -> 1080 | E32: of:=IF([.E17]<[.E31];[.E17];[.E31]) -> 2560 | F32: of:=IF([.F17]<[.F31];[.F17];[.F31]) -> 3000 | G32: of:=IF([.G17]<[.G31];[.G17];[.G31]) -> 3000 | H32: of:=IF([.H17]<[.H31];[.H17];[.H31]) -> 3000 | I32: of:=IF([.I17]<[.I31];[.I17];[.I31]) -> 3000 | J32: of:=IF([.J17]<[.J31];[.J17];[.J31]) -> 3000 | K32: of:=IF([.K17]<[.K31];[.K17];[.K31]) -> 3000 | L32: of:=IF([.L17]<[.L31];[.L17];[.L31]) -> 3000 | M32: of:=IF([.M17]<[.M31];[.M17];[.M31]) -> 3000 | N32: of:=IF([.N17]<[.N31];[.N17];[.N31]) -> 3000 | O32: of:=IF([.O17]<[.O31];[.O17];[.O31]) -> 3000 | P32: of:=IF([.P17]<[.P31];[.P17];[.P31]) -> 3000 | Q32: of:=IF([.Q17]<[.Q31];[.Q17];[.Q31]) -> 3000 | R32: Efficiency eta_min_tolerated = | S32: 0.5
A33: Gen. Energy / Wh/d | B33: of:=24 * [.B15] * [.B32] -> 100.8 | C33: of:=24 * [.C15] * [.C32] -> 478.593792 | D33: of:=24 * [.D15] * [.D32] -> 2938.62816 | E33: of:=24 * [.E15] * [.E32] -> 8527.50336 | F33: of:=24 * [.F15] * [.F32] -> 10072.8 | G33: of:=24 * [.G15] * [.G32] -> 9818.064 | H33: of:=24 * [.H15] * [.H32] -> 7349.832 | I33: of:=24 * [.I15] * [.I32] -> 6670.9008 | J33: of:=24 * [.J15] * [.J32] -> 4456.0512 | K33: of:=24 * [.K15] * [.K32] -> 2408.2056 | L33: of:=24 * [.L15] * [.L32] -> 2214.8424 | M33: of:=24 * [.M15] * [.M32] -> 1979.7336 | N33: of:=24 * [.N15] * [.N32] -> 843.7536 | O33: of:=24 * [.O15] * [.O32] -> 786.6216 | P33: of:=24 * [.P15] * [.P32] -> 265.86936 | Q33: of:=24 * [.Q15] * [.Q32] -> 361.70496 | R33: Gen.Theo.Max.Efficiency:
A34: Generator active cut in / off | B34: 0 | C34: 0 | D34: 0 | E34: 1 | F34: 1 | G34: 1 | H34: 1 | I34: 1 | J34: 1 | K34: 1 | L34: 1 | M34: 1 | N34: 1 | O34: 1 | P34: 1 | Q34: 1 | R34: Efficiency eta_max = | S34: of:=(1 - SQRT([.$I$2]*[.$E$2]/[.$G$2]))^2 -> 0.757464371712499
A35: Extracted E / Wh/d | B35: of:=([.B33]*[.B34]) -> 0 | C35: of:=([.C33]*[.C34]) -> 0 | D35: of:=([.D33]*[.D34]) -> 0 | E35: of:=([.E33]*[.E34]) -> 8527.50336 | F35: of:=([.F33]*[.F34]) -> 10072.8 | G35: of:=([.G33]*[.G34]) -> 9818.064 | H35: of:=([.H33]*[.H34]) -> 7349.832 | I35: of:=([.I33]*[.I34]) -> 6670.9008 | J35: of:=([.J33]*[.J34]) -> 4456.0512 | K35: of:=([.K33]*[.K34]) -> 2408.2056 | L35: of:=([.L33]*[.L34]) -> 2214.8424 | M35: of:=([.M33]*[.M34]) -> 1979.7336 | N35: of:=([.N33]*[.N34]) -> 843.7536 | O35: of:=([.O33]*[.O34]) -> 786.6216 | P35: of:=([.P33]*[.P34]) -> 265.86936 | Q35: of:=([.Q33]*[.Q34]) -> 361.70496 | R35: I_@eta_max = | S35: of:=SQRT([.$G$2]*[.$I$2]/[.$E$2]) -> 6.94039005276411 | T35: A
A36: ONLY CONSTRUCT A WIND POWER PLANT IF YOU HAVE HIGH WINDS! IT'S NOT A MIRACLE MACHINE. NO WIND => NO POWER OUTPUT!
A37: ONLY CONSTRUCT A HYDRO POWER PLANT IF YOU HAVE EITHER HIGH HEIGHT DIFFERENCE (head) OR HIGH FLOW (water masses)! KEEP WAY FOR FISH IN BOTH DIRECTIONS (up- and downstream).
A38: OFTEN A SIMPLE CROSS-FLOW TURBINE PRODUCES MORE AVERAGE OUTPUT IF VARIABLES LIKE FLOW RATE VARY A LOT OVER YEAR,WATER FLOW RATE AS ITS EFFICIENCY REMAINS STABLE OVER A WIDE RANGE (contrary to some others, e.g. pelton is sensible to too much water while turgo turbine isn't so much). ESPECIALLY IF NEITHER AVAILABLE HEAD NOR FLOW RATE ARE CONVINCING/HIGH ENOUGH.
A39: IT'S GOOD TO GET AN IDEA OF HOW MUCH ENERGY YOU CAN GET AND TO TEST ELECTRONICS PRINCIPLES. LATER YOU CAN STILL CONSTRUCT THE PENSTOCK WITH THE 30m HEAD PELTON OR DIRECT DRIVE TURGO TURBINE. OR THE HIGH WATER MASSES FRANCIS TURBINE OR KAPLAN TURBINE. OR VORTEX OR WHATEVER OTHER TURBINE YOU WANT TO TEST. DON'T EXCEPT MIRACLES THOUGH AND KEEP US INFORMED ABOUT RESULTS OF EXPERIMENTS AS WE DO TOO!
S41: Wind
R42: KWh/Day | S42: MWh / year
R43: of:=SUM([.B16:.Q16])/1000 -> 954.546018792 | S43: of:=(SUM([.B16:.Q16])*365.25)/1000/1000 -> 348.647933363778
R44: of:=([.B33]*[.B34])+([.C33]*[.C34])+([.D33]*[.D34])+([.E33]*[.E34])+([.F33]*[.F34])+([.G33]*[.G34])+([.H33]*[.H34])+([.I33]*[.I34])+([.J33]*[.J34])+([.K33]*[.K34])+([.L33]*[.L34])+([.M33]*[.M34])+([.N33]*[.N34])+([.O33]*[.O34])+([.P33]*[.P34])+([.Q33]*[.Q34]) -> 55755.88248 | S44: of:=SUM([.B33:.Q33]) -> 59273.904432
R45: of:=[.R44]/[.S44] -> 0.940648047640662 | S45: Generator
R46: Wh / Day | S46: KWh / month
R47: of:=SUM([.B35:.Q35]) -> 55755.88248 | S47: of:=([.R47]*30)/1000 -> 1672.6764744
R48: of:=ROUND(([.R47]/1000);2)&"KWh" -> 55.76KWh | S48: /Day
R49: W / h | S49: MWh / year
R50: of:=[.R47]/24 -> 2323.16177 | S50: of:=([.R47]*365.25)/1000/1000 -> 20.36483607582
S52: Turbine
R53: Wh / Day | S53: KWh / month
R54: of:=SUM([.B18:.Q18]) -> 381818.4075168 | S54: of:=([.R54]*30)/1000 -> 11454.552225504
R55: of:=ROUND(([.R54]/1000);2)&"KWh" -> 381.82KWh | S55: /Day
R56: W / h | S56: MWh / year
R57: of:=[.R54]/24 -> 15909.1003132 | S57: of:=([.R54]*365.25)/1000/1000 -> 139.459173345511

Sheet: Flow
A1: https://github.com/worlddevelopment/energy_through_airflow | E1: Flow Power Calculator | J1: By Electrodacus & Faerietree (J.R.I.B.-Wein) | L1: Max Current before winding breakdown/ Melting I_max / A | M1: INPUT FIELDS Only input data on cells with this color.
C2: Generator- Specifi- cation: | → → → | D2: 1440 | E2: ← KV / rpm/V Revolutions/minute that are required to generate exactly 1V. | F2: Kt / Nm/A→ Torque constant, i.e. torque / 1A current. | G2: of:=1/[.D2] * VALUE(LEFT([.$A$21]; SEARCH(" "; [.$A$21]) - 1)) -> 0.0486111111111111 | H2: ← Note that the transmission influences this motor constant directly to simplify formulas. | J2: Is V/freq/rpm- Controlled: | K2: 0 | L2: 50 | M2: CC-BY-SA Licence (SA = share alike) Use, share, give credit! And share improvements. Avoid reinventing the wheel. For a better world.
C3: Use self-excitated! e.g. permanent magnets. #Generators = | D3: TODO: Use peak Voltage/Back EMF isntead of RMS voltage for bushless / 3phase. May depend on motor type? V_RMS/RPM | E3: Ri / ohm | F3: P_Nominal / W | G3: V_RMS_N. / V | H3: Power Factor Motor plate or figure out, e.g. measure. | I3: Idle Current I_0 / A | J3: f / Hz | K3: V_peak_N. / V | L3: R_L / ohm | M3: UseW/%= | N3: of:=([.S52]/SUM([.B13:.Q13])) -> 0.23496004682981 | O3: of total Flow-Energy.
C4: 1 | D4: of:=[.G4]/[.D2] -> 0.263888888888889 | E4: 7.1 | F4: 3000 | G4: 380 | H4: 0.87 | I4: 0.09 | J4: 50 | K4: of:=[.$G$4]*SQRT(2) -> 537.401153701776 | L4: 100 | M4: UseT/%= | N4: of:=([.R52]/SUM([.B15:.Q15])) -> 0 | O4: of available Turbine-Enery.
A6: Area_Turbine_in_Flow / m = | B6: of:=IF([Turbine.$B$12]>0; [Turbine.B10] * [Turbine.$B$11]; PI() * ([Turbine.B10]/2)^2) -> 2 | C6: of:=[.B6] -> 2 | D6: of:=[.C6] -> 2 | E6: of:=[.D6] -> 2 | F6: of:=[.E6] -> 2 | G6: of:=[.F6] -> 2 | H6: of:=[.G6] -> 2 | I6: of:=[.H6] -> 2 | J6: of:=[.I6] -> 2 | K6: of:=[.J6] -> 2 | L6: of:=[.K6] -> 2 | M6: of:=[.L6] -> 2 | N6: of:=[.M6] -> 2 | O6: of:=[.N6] -> 2 | P6: of:=[.O6] -> 2 | Q6: of:=[.P6] -> 2
C7: of:=[Turbine.$B$10] -> 1 | D7: of:=[Turbine.$B$10] -> 1 | E7: of:=[Turbine.$B$10] -> 1 | F7: of:=[Turbine.$B$10] -> 1 | G7: of:=[Turbine.$B$10] -> 1 | H7: of:=[Turbine.$B$10] -> 1 | I7: of:=[Turbine.$B$10] -> 1 | J7: of:=[Turbine.$B$10] -> 1 | K7: of:=[Turbine.$B$10] -> 1 | L7: of:=[Turbine.$B$10] -> 1 | M7: of:=[Turbine.$B$10] -> 1 | N7: of:=[Turbine.$B$10] -> 1 | O7: of:=[Turbine.$B$10] -> 1 | P7: of:=[Turbine.$B$10] -> 1 | Q7: of:=[Turbine.$B$10] -> 1 | R7: V_Wind_ideal | S7: V_Wind_critical | T7: Notes: | → → →
A8: Area correction factor (negative contributions) = | B8: 0.5 | C8: ← Useful for run-of-the-stream or special flow crossflow turbines, where negative contributions exist or parts are taken entirely out of the flow. Because despite drag contributions, there still are some losses due to the resistance of the second part. Worst case is 0.5. | R8: |||||| | S8: ||||||||||||| | T8: V_overdrive_IM
A9: density_air/fluid / kg/m^3= (e.g. 1.225 @ 0m height @15°C temp.) | B9: 1000 | C9: of:=CONCATENATE(ROUND([.C10] * 3.6; 2); "km/h") -> 7.2km/h | D9: of:=CONCATENATE(ROUND([.D10] * 3.6; 2); "km/h") -> 10.8km/h | E9: of:=CONCATENATE(ROUND([.E10] * 3.6; 2); "km/h") -> 14.4km/h | F9: of:=CONCATENATE(ROUND([.F10] * 3.6; 2); "km/h") -> 18km/h | G9: of:=CONCATENATE(ROUND([.G10] * 3.6; 2); "km/h") -> 21.6km/h | H9: of:=CONCATENATE(ROUND([.H10] * 3.6; 2); "km/h") -> 25.2km/h | I9: of:=CONCATENATE(ROUND([.I10] * 3.6; 2); "km/h") -> 28.8km/h | J9: of:=CONCATENATE(ROUND([.J10] * 3.6; 2); "km/h") -> 32.4km/h | K9: of:=CONCATENATE(ROUND([.K10] * 3.6; 2); "km/h") -> 36km/h | L9: of:=CONCATENATE(ROUND([.L10] * 3.6; 2); "km/h") -> 39.6km/h | M9: of:=CONCATENATE(ROUND([.M10] * 3.6; 2); "km/h") -> 43.2km/h | N9: of:=CONCATENATE(ROUND([.N10] * 3.6; 2); "km/h") -> 46.8km/h | O9: of:=CONCATENATE(ROUND([.O10] * 3.6; 2); "km/h") -> 50.4km/h | P9: of:=CONCATENATE(ROUND([.P10] * 3.6; 2); "km/h") -> 54km/h | Q9: of:=CONCATENATE(ROUND([.Q10] * 3.6; 2); "km/h") -> 57.6km/h | R9: of:=CONCATENATE(ROUND([.R10] * 3.6; 2); "km/h") -> 5.97km/h | S9: of:=CONCATENATE(ROUND([.S10] * 3.6; 2); "km/h") -> 6.56km/h | T9: of:=CONCATENATE(ROUND([.T10] * 3.6; 2); "km/h") -> 6.14km/h | U9: ← Required average flowspeed to guarantuee rpm, to ease the ELC's job.
A10: Flow speed / m/s | B10: 1 | C10: 2 | D10: 3 | E10: 4 | F10: 5 | G10: 6 | H10: 7 | I10: 8 | J10: 9 | K10: 10 | L10: 11 | M10: 12 | N10: 13 | O10: 14 | P10: 15 | Q10: 16 | R10: of:=([Turbine.$B$10]*PI())/[.R20] / [Turbine.$B$8] -> 1.65710381727813 | S10: of:=([Turbine.$B$10]*PI())/[.S20] / [Turbine.$B$8] -> 1.82281419900595 | T10: of:=([Turbine.$B$10]*PI())/[.T20] / [Turbine.$B$8] -> 1.70681693179648
A11: Flow Power_Flow / W = | B11: of:=IF([Turbine.$B$12]>0; 0.5*[.$B$9]*([.B$6]*[.$B$8])*([.B$10]^3); 0.5*[.$B$9]*[.B$6]*([.B$10]^3)) -> 500 | C11: of:=IF([Turbine.$B$12]>0; 0.5*[.$B$9]*([.C$6]*[.$B$8])*([.C$10]^3); 0.5*[.$B$9]*[.C$6]*([.C$10]^3)) -> 4000 | D11: of:=IF([Turbine.$B$12]>0; 0.5*[.$B$9]*([.D$6]*[.$B$8])*([.D$10]^3); 0.5*[.$B$9]*[.D$6]*([.D$10]^3)) -> 13500 | E11: of:=IF([Turbine.$B$12]>0; 0.5*[.$B$9]*([.E$6]*[.$B$8])*([.E$10]^3); 0.5*[.$B$9]*[.E$6]*([.E$10]^3)) -> 32000 | F11: of:=IF([Turbine.$B$12]>0; 0.5*[.$B$9]*([.F$6]*[.$B$8])*([.F$10]^3); 0.5*[.$B$9]*[.F$6]*([.F$10]^3)) -> 62500 | G11: of:=IF([Turbine.$B$12]>0; 0.5*[.$B$9]*([.G$6]*[.$B$8])*([.G$10]^3); 0.5*[.$B$9]*[.G$6]*([.G$10]^3)) -> 108000 | H11: of:=IF([Turbine.$B$12]>0; 0.5*[.$B$9]*([.H$6]*[.$B$8])*([.H$10]^3); 0.5*[.$B$9]*[.H$6]*([.H$10]^3)) -> 171500 | I11: of:=IF([Turbine.$B$12]>0; 0.5*[.$B$9]*([.I$6]*[.$B$8])*([.I$10]^3); 0.5*[.$B$9]*[.I$6]*([.I$10]^3)) -> 256000 | J11: of:=IF([Turbine.$B$12]>0; 0.5*[.$B$9]*([.J$6]*[.$B$8])*([.J$10]^3); 0.5*[.$B$9]*[.J$6]*([.J$10]^3)) -> 364500 | K11: of:=IF([Turbine.$B$12]>0; 0.5*[.$B$9]*([.K$6]*[.$B$8])*([.K$10]^3); 0.5*[.$B$9]*[.K$6]*([.K$10]^3)) -> 500000 | L11: of:=IF([Turbine.$B$12]>0; 0.5*[.$B$9]*([.L$6]*[.$B$8])*([.L$10]^3); 0.5*[.$B$9]*[.L$6]*([.L$10]^3)) -> 665500 | M11: of:=IF([Turbine.$B$12]>0; 0.5*[.$B$9]*([.M$6]*[.$B$8])*([.M$10]^3); 0.5*[.$B$9]*[.M$6]*([.M$10]^3)) -> 864000 | N11: of:=IF([Turbine.$B$12]>0; 0.5*[.$B$9]*([.N$6]*[.$B$8])*([.N$10]^3); 0.5*[.$B$9]*[.N$6]*([.N$10]^3)) -> 1098500 | O11: of:=IF([Turbine.$B$12]>0; 0.5*[.$B$9]*([.O$6]*[.$B$8])*([.O$10]^3); 0.5*[.$B$9]*[.O$6]*([.O$10]^3)) -> 1372000 | P11: of:=IF([Turbine.$B$12]>0; 0.5*[.$B$9]*([.P$6]*[.$B$8])*([.P$10]^3); 0.5*[.$B$9]*[.P$6]*([.P$10]^3)) -> 1687500 | Q11: of:=IF([Turbine.$B$12]>0; 0.5*[.$B$9]*([.Q$6]*[.$B$8])*([.Q$10]^3); 0.5*[.$B$9]*[.Q$6]*([.Q$10]^3)) -> 2048000 | R11: of:=IF([Turbine.$B$12]>0; 0.5*[.$B$9]*([.$B$6]*[.$B$8])*([.R$10]^3); 0.5*[.$B$9]*[.$B$6]*([.R$10]^3)) -> 2275.19779199818 | S11: of:=IF([Turbine.$B$12]>0; 0.5*[.$B$9]*([.$B$6]*[.$B$8])*([.S$10]^3); 0.5*[.$B$9]*[.$B$6]*([.S$10]^3)) -> 3028.28826114957 | T11: of:=IF([Turbine.$B$12]>0; 0.5*[.$B$9]*([.$B$6]*[.$B$8])*([.T$10]^3); 0.5*[.$B$9]*[.$B$6]*([.T$10]^3)) -> 2486.17005765679
A12: of:=CONCATENATE("Day-Flow-Distrib. (=>"; ROUND([.B12]*[.B10] + [.C12]*[.C10] + [.D12]*[.D10] + [.E12]*[.E10] + [.F12]*[.F10] + [.G12]*[.G10] + [.H12]*[.H10]+ [.I12]*[.I10]+ [.J12]*[.J10] + [.K12]*[.K10] + [.L12]*[.L10] + [.M12]*[.M10] + [.N12]*[.N10] + [.O12]*[.O10] + [.P12]*[.P10] + [.Q12]*[.Q10]; 1); "m/s)") -> Day-Flow-Distrib. (=>1.3m/s) | B12: 0.8 | C12: 0.15 | D12: 0.05 | E12: 0 | F12: 0 | G12: 0 | H12: 0 | I12: 0 | J12: 0 | K12: 0 | L12: 0 | M12: 0 | N12: 0 | O12: 0 | P12: 0 | Q12: 0 | R12: of:=CONCATENATE(" = "; ROUND(SUM([.B12:.Q12]); 4) * 100; "%") ->  = 100% | S12: ← Total Flow % / 24h
A13: Flow Energy / Wh/d | B13: of:=24 * [.B12] * [.B11] -> 9600 | C13: of:=24 * [.C12] * [.C11] -> 14400 | D13: of:=24 * [.D12] * [.D11] -> 16200 | E13: of:=24 * [.E12] * [.E11] -> 0 | F13: of:=24 * [.F12] * [.F11] -> 0 | G13: of:=24 * [.G12] * [.G11] -> 0 | H13: of:=24 * [.H12] * [.H11] -> 0 | I13: of:=24 * [.I12] * [.I11] -> 0 | J13: of:=24 * [.J12] * [.J11] -> 0 | K13: of:=24 * [.K12] * [.K11] -> 0 | L13: of:=24 * [.L12] * [.L11] -> 0 | M13: of:=24 * [.M12] * [.M11] -> 0 | N13: of:=24 * [.N12] * [.N11] -> 0 | O13: of:=24 * [.O12] * [.O11] -> 0 | P13: of:=24 * [.P12] * [.P11] -> 0 | Q13: of:=24 * [.Q12] * [.Q11] -> 0
A14: Turbine Power P_mech / W | B14: of:=[.B11]*[Turbine.$B$3] -> 150 | C14: of:=[.C11]*[Turbine.$B$3] -> 1200 | D14: of:=[.D11]*[Turbine.$B$3] -> 4050 | E14: of:=[.E11]*[Turbine.$B$3] -> 9600 | F14: of:=[.F11]*[Turbine.$B$3] -> 18750 | G14: of:=[.G11]*[Turbine.$B$3] -> 32400 | H14: of:=[.H11]*[Turbine.$B$3] -> 51450 | I14: of:=[.I11]*[Turbine.$B$3] -> 76800 | J14: of:=[.J11]*[Turbine.$B$3] -> 109350 | K14: of:=[.K11]*[Turbine.$B$3] -> 150000 | L14: of:=[.L11]*[Turbine.$B$3] -> 199650 | M14: of:=[.M11]*[Turbine.$B$3] -> 259200 | N14: of:=[.N11]*[Turbine.$B$3] -> 329550 | O14: of:=[.O11]*[Turbine.$B$3] -> 411600 | P14: of:=[.P11]*[Turbine.$B$3] -> 506250 | Q14: of:=[.Q11]*[Turbine.$B$3] -> 614400 | R14: of:=[.R11]*[Turbine.$B$3] -> 682.559337599453 | S14: of:=[.S11]*[Turbine.$B$3] -> 908.486478344872 | T14: of:=[.T11]*[Turbine.$B$3] -> 745.851017297038
A15: Turbine Energy / Wh/d | B15: of:=24 * [.B12] * [.B14] -> 2880 | C15: of:=24 * [.C12] * [.C14] -> 4320 | D15: of:=24 * [.D12] * [.D14] -> 4860 | E15: of:=24 * [.E12] * [.E14] -> 0 | F15: of:=24 * [.F12] * [.F14] -> 0 | G15: of:=24 * [.G12] * [.G14] -> 0 | H15: of:=24 * [.H12] * [.H14] -> 0 | I15: of:=24 * [.I12] * [.I14] -> 0 | J15: of:=24 * [.J12] * [.J14] -> 0 | K15: of:=24 * [.K12] * [.K14] -> 0 | L15: of:=24 * [.L12] * [.L14] -> 0 | M15: of:=24 * [.M12] * [.M14] -> 0 | N15: of:=24 * [.N12] * [.N14] -> 0 | O15: of:=24 * [.O12] * [.O14] -> 0 | P15: of:=24 * [.P12] * [.P14] -> 0 | Q15: of:=24 * [.Q12] * [.Q14] -> 0
A16: Turbine Torque_mechanic / Nm = | B16: of:=[.B$14] / 2 / PI() * [.B$20] -> 115.384615384615 | C16: of:=[.C$14] / 2 / PI() * [.C$20] -> 461.538461538462 | D16: of:=[.D$14] / 2 / PI() * [.D$20] -> 1038.46153846154 | E16: of:=[.E$14] / 2 / PI() * [.E$20] -> 1846.15384615385 | F16: of:=[.F$14] / 2 / PI() * [.F$20] -> 2884.61538461538 | G16: of:=[.G$14] / 2 / PI() * [.G$20] -> 4153.84615384615 | H16: of:=[.H$14] / 2 / PI() * [.H$20] -> 5653.84615384615 | I16: of:=[.I$14] / 2 / PI() * [.I$20] -> 7384.61538461539 | J16: of:=[.J$14] / 2 / PI() * [.J$20] -> 9346.15384615385 | K16: of:=[.K$14] / 2 / PI() * [.K$20] -> 11538.4615384615 | L16: of:=[.L$14] / 2 / PI() * [.L$20] -> 13961.5384615385 | M16: of:=[.M$14] / 2 / PI() * [.M$20] -> 16615.3846153846 | N16: of:=[.N$14] / 2 / PI() * [.N$20] -> 19500 | O16: of:=[.O$14] / 2 / PI() * [.O$20] -> 22615.3846153846 | P16: of:=[.P$14] / 2 / PI() * [.P$20] -> 25961.5384615385 | Q16: of:=[.Q$14] / 2 / PI() * [.Q$20] -> 29538.4615384615 | R16: of:=[.R$14] / 2 / PI() * [.R$20] -> 316.845353219741 | S16: of:=[.S$14] / 2 / PI() * [.S$20] -> 383.382877395887 | T16: of:=[.T$14] / 2 / PI() * [.T$20] -> 336.141235230824 | U16: ← Assumes the generator is prevented to generate more than its design power. (see red alert background in the power / power_nominal ratio above)
A17: P_Generator/P_Nominal | B17: of:=[.B$23] * [.B$24] / [.$F$4] -> 0.0448605484313014 | C17: of:=[.C$23] * [.C$24] / [.$F$4] -> 0.370696026119144 | D17: of:=[.D$23] * [.D$24] / [.$F$4] -> 1.26896592526566 | E17: of:=[.E$23] * [.E$24] / [.$F$4] -> 3.03330830908745 | F17: of:=[.F$23] * [.F$24] / [.$F$4] -> 5.95839046522532 | G17: of:=[.G$23] * [.G$24] / [.$F$4] -> 10.3395244410757 | H17: of:=[.H$23] * [.H$24] / [.$F$4] -> 16.4724765484507 | I17: of:=[.I$23] * [.I$24] / [.$F$4] -> 24.6533558729558 | J17: of:=[.J$23] * [.J$24] / [.$F$4] -> 35.1785422065751 | K17: of:=[.K$23] * [.K$24] / [.$F$4] -> 48.3446362281573 | L17: of:=[.L$23] * [.L$24] / [.$F$4] -> 64.4484233428191 | M17: of:=[.M$23] * [.M$24] / [.$F$4] -> 83.7868464420733 | N17: of:=[.N$23] * [.N$24] / [.$F$4] -> 106.656984773762 | O17: of:=[.O$23] * [.O$24] / [.$F$4] -> 133.356037157687 | P17: of:=[.P$23] * [.P$24] / [.$F$4] -> 164.181308388836 | Q17: of:=[.Q$23] * [.Q$24] / [.$F$4] -> 199.430198039372 | R17: of:=[.R$23] * [.R$24] / [.$F$4] -> 0.209242537321662 | S17: of:=[.S$23] * [.S$24] / [.$F$4] -> 0.27961133776623 | T17: of:=[.T$23] * [.T$24] / [.$F$4] -> 0.228931930865168 | U17: ← Auslastung / Generator capacity usage. Red is only tolerable to a certain degree. At some point the mechanic will break, even if the rotor is electrically/mechanically deccelerated to not go over the rated RPM.
A18: Generato Power_max_avail / W = | B18: of:=[.B$14] * [.B$26] -> 134.581645293904 | C18: of:=[.C$14] * [.C$26] -> 1112.08807835743 | D18: of:=[.D$14] * [.D$26] -> 3806.89777579697 | E18: of:=[.E$14] * [.E$26] -> 9099.92492726236 | F18: of:=[.F$14] * [.F$26] -> 17875.1713956759 | G18: of:=[.G$14] * [.G$26] -> 31018.5733232272 | H18: of:=[.H$14] * [.H$26] -> 49417.4296453522 | I18: of:=[.I$14] * [.I$26] -> 73960.0676188675 | J18: of:=[.J$14] * [.J$26] -> 105535.626619725 | K18: of:=[.K$14] * [.K$26] -> 145033.908684472 | L18: of:=[.L$14] * [.L$26] -> 193345.270028457 | M18: of:=[.M$14] * [.M$26] -> 251360.53932622 | N18: of:=[.N$14] * [.N$26] -> 319970.954321286 | O18: of:=[.O$14] * [.O$26] -> 400068.111473061 | P18: of:=[.P$14] * [.P$26] -> 492543.925166507 | Q18: of:=[.Q$14] * [.Q$26] -> 598290.594118115 | R18: of:=[.R$14] * [.R$26] -> 627.727611964986 | S18: of:=[.S$14] * [.S$26] -> 838.83401329869 | T18: of:=[.T$14] * [.T$26] -> 686.795792595503 | U18: ← Assumes the generator is prevented to generate more than its design power. (see red alert background in the power / power_nominal ratio above)
A19: I_max + ΔI_for_V-drop-req_for_V-control / A | B19: of:=([.B$23]-[.$G$4]) / [.$L$4] + [.B$24] -> -0.9199589541998 | C19: of:=([.C$23]-[.$G$4]) / [.$L$4] + [.C$24] -> 3.21111152210988 | D19: of:=([.D$23]-[.$G$4]) / [.$L$4] + [.D$24] -> 8.61317841186717 | E19: of:=([.E$23]-[.$G$4]) / [.$L$4] + [.E$24] -> 15.2933669486464 | F19: of:=([.F$23]-[.$G$4]) / [.$L$4] + [.F$24] -> 23.2557951239868 | G19: of:=([.G$23]-[.$G$4]) / [.$L$4] + [.G$24] -> 32.5032414357511 | H19: of:=([.H$23]-[.$G$4]) / [.$L$4] + [.H$24] -> 43.0377456498998 | I19: of:=([.I$23]-[.$G$4]) / [.$L$4] + [.I$24] -> 54.8608881873357 | J19: of:=([.J$23]-[.$G$4]) / [.$L$4] + [.J$24] -> 67.97394055842 | K19: of:=([.K$23]-[.$G$4]) / [.$L$4] + [.K$24] -> 82.3779546423694 | L19: of:=([.L$23]-[.$G$4]) / [.$L$4] + [.L$24] -> 98.073819513473 | M19: of:=([.M$23]-[.$G$4]) / [.$L$4] + [.M$24] -> 115.062299579573 | N19: of:=([.N$23]-[.$G$4]) / [.$L$4] + [.N$24] -> 133.344061266703 | O19: of:=([.O$23]-[.$G$4]) / [.$L$4] + [.O$24] -> 152.919692328318 | P19: of:=([.P$23]-[.$G$4]) / [.$L$4] + [.P$24] -> 173.789716210924 | Q19: of:=([.Q$23]-[.$G$4]) / [.$L$4] + [.Q$24] -> 195.954602993953 | R19: of:=([.R$23]-[.$G$4]) / [.$L$4] + [.R$24] -> 1.65191476832891 | S19: of:=([.S$23]-[.$G$4]) / [.$L$4] + [.S$24] -> 2.38677993612127 | T19: of:=([.T$23]-[.$G$4]) / [.$L$4] + [.T$24] -> 1.86871587275295
A20: T_period_turbine / s (time/revolution) | B20: of:=(2*[Turbine.B10]/2*PI())/([.B10] * [Turbine.$B$8]) -> 4.83321946706122 | C20: of:=(2*[.C7]/2*PI())/([.C10] * [Turbine.$B$8]) -> 2.41660973353061 | D20: of:=(2*[.D7]/2*PI())/([.D10] * [Turbine.$B$8]) -> 1.61107315568707 | E20: of:=(2*[.E7]/2*PI())/([.E10] * [Turbine.$B$8]) -> 1.20830486676531 | F20: of:=(2*[.F7]/2*PI())/([.F10] * [Turbine.$B$8]) -> 0.966643893412244 | G20: of:=(2*[.G7]/2*PI())/([.G10] * [Turbine.$B$8]) -> 0.805536577843537 | H20: of:=(2*[.H7]/2*PI())/([.H10] * [Turbine.$B$8]) -> 0.690459923865889 | I20: of:=(2*[.I7]/2*PI())/([.I10] * [Turbine.$B$8]) -> 0.604152433382652 | J20: of:=(2*[.J7]/2*PI())/([.J10] * [Turbine.$B$8]) -> 0.537024385229024 | K20: of:=(2*[.K7]/2*PI())/([.K10] * [Turbine.$B$8]) -> 0.483321946706122 | L20: of:=(2*[.L7]/2*PI())/([.L10] * [Turbine.$B$8]) -> 0.439383587914656 | M20: of:=(2*[.M7]/2*PI())/([.M10] * [Turbine.$B$8]) -> 0.402768288921768 | N20: of:=(2*[.N7]/2*PI())/([.N10] * [Turbine.$B$8]) -> 0.371786112850863 | O20: of:=(2*[.O7]/2*PI())/([.O10] * [Turbine.$B$8]) -> 0.345229961932944 | P20: of:=(2*[.P7]/2*PI())/([.P10] * [Turbine.$B$8]) -> 0.322214631137415 | Q20: of:=([.Q7]*PI())/([.Q10] * [Turbine.$B$8]) -> 0.302076216691326 | R20: of:=60/[.R21] -> 2.91666666666667 | S20: of:=60/[.S21] -> 2.65151515151515 | T20: of:=60/[.T21] -> 2.83171521035599
A21: of:=CONCATENATE(70; "  ←Ratio Transm.Gen./Turb. | @1:1→") -> 70  ←Ratio Transm.Gen./Turb. | @1:1→ | B21: of:=60/[.B20] -> 12.4140855611678 | C21: of:=60/[.C20] -> 24.8281711223357 | D21: of:=60/[.D20] -> 37.2422566835035 | E21: of:=60/[.E20] -> 49.6563422446714 | F21: of:=60/[.F20] -> 62.0704278058392 | G21: of:=60/[.G20] -> 74.484513367007 | H21: of:=60/[.H20] -> 86.8985989281748 | I21: of:=60/[.I20] -> 99.3126844893427 | J21: of:=60/[.J20] -> 111.726770050511 | K21: of:=60/[.K20] -> 124.140855611678 | L21: of:=60/[.L20] -> 136.554941172846 | M21: of:=60/[.M20] -> 148.969026734014 | N21: of:=60/[.N20] -> 161.383112295182 | O21: of:=60/[.O20] -> 173.79719785635 | P21: of:=60/[.P20] -> 186.211283417518 | Q21: of:=60/[.Q20] -> 198.625368978685 | R21: of:=[.R22] / VALUE(LEFT([.$A$21]; SEARCH(" "; [.$A$21]) - 1)) -> 20.5714285714286 | S21: of:=[.S22] / VALUE(LEFT([.$A$21]; SEARCH(" "; [.$A$21]) - 1)) -> 22.6285714285714 | T21: of:=[.T22] / VALUE(LEFT([.$A$21]; SEARCH(" "; [.$A$21]) - 1)) -> 21.1885714285714
A22: Generator Revolutio/min (rpm) | B22: of:=[.B21]* VALUE(LEFT([.$A$21]; SEARCH(" "; [.$A$21]) - 1)) -> 868.985989281749 | C22: of:=[.C21]* VALUE(LEFT([.$A$21]; SEARCH(" "; [.$A$21]) - 1)) -> 1737.9719785635 | D22: of:=[.D21]* VALUE(LEFT([.$A$21]; SEARCH(" "; [.$A$21]) - 1)) -> 2606.95796784525 | E22: of:=[.E21]* VALUE(LEFT([.$A$21]; SEARCH(" "; [.$A$21]) - 1)) -> 3475.94395712699 | F22: of:=[.F21]* VALUE(LEFT([.$A$21]; SEARCH(" "; [.$A$21]) - 1)) -> 4344.92994640874 | G22: of:=[.G21]* VALUE(LEFT([.$A$21]; SEARCH(" "; [.$A$21]) - 1)) -> 5213.91593569049 | H22: of:=[.H21]* VALUE(LEFT([.$A$21]; SEARCH(" "; [.$A$21]) - 1)) -> 6082.90192497224 | I22: of:=[.I21]* VALUE(LEFT([.$A$21]; SEARCH(" "; [.$A$21]) - 1)) -> 6951.88791425399 | J22: of:=[.J21]* VALUE(LEFT([.$A$21]; SEARCH(" "; [.$A$21]) - 1)) -> 7820.87390353574 | K22: of:=[.K21]* VALUE(LEFT([.$A$21]; SEARCH(" "; [.$A$21]) - 1)) -> 8689.85989281749 | L22: of:=[.L21]* VALUE(LEFT([.$A$21]; SEARCH(" "; [.$A$21]) - 1)) -> 9558.84588209923 | M22: of:=[.M21]* VALUE(LEFT([.$A$21]; SEARCH(" "; [.$A$21]) - 1)) -> 10427.831871381 | N22: of:=[.N21]* VALUE(LEFT([.$A$21]; SEARCH(" "; [.$A$21]) - 1)) -> 11296.8178606627 | O22: of:=[.O21]* VALUE(LEFT([.$A$21]; SEARCH(" "; [.$A$21]) - 1)) -> 12165.8038499445 | P22: of:=[.P21]* VALUE(LEFT([.$A$21]; SEARCH(" "; [.$A$21]) - 1)) -> 13034.7898392262 | Q22: of:=[.Q21]* VALUE(LEFT([.$A$21]; SEARCH(" "; [.$A$21]) - 1)) -> 13903.775828508 | R22: of:=([.R23] / [.$D$4]) -> 1440 | S22: of:=([.S23] / [.$D$4]) -> 1584 | T22: of:=[.R22] + [.R22]*0.03 -> 1483.2
A23: Voltage_RMS @xRPM / V | B23: of:=IF([.$J$4]>0; [.B22]*[.$D$4]; [.B22]*[.$D$4]) -> 229.315747171573 | C23: of:=IF([.$J$4]>0; [.C22]*[.$D$4]; [.C22]*[.$D$4]) -> 458.631494343145 | D23: of:=IF([.$J$4]>0; [.D22]*[.$D$4]; [.D22]*[.$D$4]) -> 687.947241514718 | E23: of:=IF([.$J$4]>0; [.E22]*[.$D$4]; [.E22]*[.$D$4]) -> 917.26298868629 | F23: of:=IF([.$J$4]>0; [.F22]*[.$D$4]; [.F22]*[.$D$4]) -> 1146.57873585786 | G23: of:=IF([.$J$4]>0; [.G22]*[.$D$4]; [.G22]*[.$D$4]) -> 1375.89448302944 | H23: of:=IF([.$J$4]>0; [.H22]*[.$D$4]; [.H22]*[.$D$4]) -> 1605.21023020101 | I23: of:=IF([.$J$4]>0; [.I22]*[.$D$4]; [.I22]*[.$D$4]) -> 1834.52597737258 | J23: of:=IF([.$J$4]>0; [.J22]*[.$D$4]; [.J22]*[.$D$4]) -> 2063.84172454415 | K23: of:=IF([.$J$4]>0; [.K22]*[.$D$4]; [.K22]*[.$D$4]) -> 2293.15747171573 | L23: of:=IF([.$J$4]>0; [.L22]*[.$D$4]; [.L22]*[.$D$4]) -> 2522.4732188873 | M23: of:=IF([.$J$4]>0; [.M22]*[.$D$4]; [.M22]*[.$D$4]) -> 2751.78896605887 | N23: of:=IF([.$J$4]>0; [.N22]*[.$D$4]; [.N22]*[.$D$4]) -> 2981.10471323044 | O23: of:=IF([.$J$4]>0; [.O22]*[.$D$4]; [.O22]*[.$D$4]) -> 3210.42046040202 | P23: of:=IF([.$J$4]>0; [.P22]*[.$D$4]; [.P22]*[.$D$4]) -> 3439.73620757359 | Q23: of:=IF([.$J$4]>0; [.Q22]*[.$D$4]; [.Q22]*[.$D$4]) -> 3669.05195474516 | R23: of:=IF([.$J$4] > 0 ; [.$G$4]; [.$G$4]) -> 380 | S23: of:=IF([.$J$4] > 0 ; ([.$G$4] + ([.$G$4] * 0.1)) ; [.$G$4] + ([.$G$4] * 0.1)) -> 418 | T23: of:=IF([.$J$4]>0; [.T22]*[.$D$4]; [.T22]*[.$D$4]) -> 391.4 | U23: ← V_still_safe_to_operate_generate_at = V_Nominal/Design + delta V_margin
A24: I_max_available / Ampère V- drop over resitsance will back-couple. | B24: of:=IF( [.B$23] / [.$E$4] * [.B$23] > [.B$18]; [.B$18]/[.B$23]; [.B$23] / [.$L$4]) -> 0.586883574084474 | C24: of:=IF( [.C$23] / [.$E$4] * [.C$23] > [.C$18]; [.C$18]/[.C$23]; [.C$23] / [.$L$4]) -> 2.42479657867843 | D24: of:=IF( [.D$23] / [.$E$4] * [.D$23] > [.D$18]; [.D$18]/[.D$23]; [.D$23] / [.$L$4]) -> 5.53370599672 | E24: of:=IF( [.E$23] / [.$E$4] * [.E$23] > [.E$18]; [.E$18]/[.E$23]; [.E$23] / [.$L$4]) -> 9.92073706178348 | F24: of:=IF( [.F$23] / [.$E$4] * [.F$23] > [.F$18]; [.F$18]/[.F$23]; [.F$23] / [.$L$4]) -> 15.5900077654082 | G24: of:=IF( [.G$23] / [.$E$4] * [.G$23] > [.G$18]; [.G$18]/[.G$23]; [.G$23] / [.$L$4]) -> 22.5442966054568 | H24: of:=IF( [.H$23] / [.$E$4] * [.H$23] > [.H$18]; [.H$18]/[.H$23]; [.H$23] / [.$L$4]) -> 30.7856433478898 | I24: of:=IF( [.I$23] / [.$E$4] * [.I$23] > [.I$18]; [.I$18]/[.I$23]; [.I$23] / [.$L$4]) -> 40.3156284136099 | J24: of:=IF( [.J$23] / [.$E$4] * [.J$23] > [.J$18]; [.J$18]/[.J$23]; [.J$23] / [.$L$4]) -> 51.1355233129784 | K24: of:=IF( [.K$23] / [.$E$4] * [.K$23] > [.K$18]; [.K$18]/[.K$23]; [.K$23] / [.$L$4]) -> 63.2463799252122 | L24: of:=IF( [.L$23] / [.$E$4] * [.L$23] > [.L$18]; [.L$18]/[.L$23]; [.L$23] / [.$L$4]) -> 76.6490873246 | M24: of:=IF( [.M$23] / [.$E$4] * [.M$23] > [.M$18]; [.M$18]/[.M$23]; [.M$23] / [.$L$4]) -> 91.3444099189845 | N24: of:=IF( [.N$23] / [.$E$4] * [.N$23] > [.N$18]; [.N$18]/[.N$23]; [.N$23] / [.$L$4]) -> 107.333014134399 | O24: of:=IF( [.O$23] / [.$E$4] * [.O$23] > [.O$18]; [.O$18]/[.O$23]; [.O$23] / [.$L$4]) -> 124.615487724298 | P24: of:=IF( [.P$23] / [.$E$4] * [.P$23] > [.P$18]; [.P$18]/[.P$23]; [.P$23] / [.$L$4]) -> 143.192354135188 | Q24: of:=IF( [.Q$23] / [.$E$4] * [.Q$23] > [.Q$18]; [.Q$18]/[.Q$23]; [.Q$23] / [.$L$4]) -> 163.064083446502 | R24: of:=IF( [.R$23] / [.$E$4] * [.R$23] > [.R$18]; [.R$18]/[.R$23]; [.R$23] / [.$L$4]) -> 1.65191476832891 | S24: of:=IF( [.S$23] / [.$E$4] * [.S$23] > [.S$18]; [.S$18]/[.S$23]; [.S$23] / [.$L$4]) -> 2.00677993612127 | T24: of:=IF( [.T$23] / [.$E$4] * [.T$23] > [.T$18]; [.T$18]/[.T$23]; [.T$23] / [.$L$4]) -> 1.75471587275295
A25: Generator Torque / Nm | B25: of:=IF([.$K$2]>0; [.$G$2] * [.B19]; [.$G$2] * [.B24]) -> 0.0285290626291064 | C25: of:=IF([.$K$2]>0; [.$G$2] * [.C19]; [.$G$2] * [.C24]) -> 0.117872055907979 | D25: of:=IF([.$K$2]>0; [.$G$2] * [.D19]; [.$G$2] * [.D24]) -> 0.268999597062778 | E25: of:=IF([.$K$2]>0; [.$G$2] * [.E19]; [.$G$2] * [.E24]) -> 0.482258051614475 | F25: of:=IF([.$K$2]>0; [.$G$2] * [.F19]; [.$G$2] * [.F24]) -> 0.757847599707341 | G25: of:=IF([.$K$2]>0; [.$G$2] * [.G19]; [.$G$2] * [.G24]) -> 1.0959033072097 | H25: of:=IF([.$K$2]>0; [.$G$2] * [.H19]; [.$G$2] * [.H24]) -> 1.49652432941131 | I25: of:=IF([.$K$2]>0; [.$G$2] * [.I19]; [.$G$2] * [.I24]) -> 1.95978749232826 | J25: of:=IF([.$K$2]>0; [.$G$2] * [.J19]; [.$G$2] * [.J24]) -> 2.48575460549201 | K25: of:=IF([.$K$2]>0; [.$G$2] * [.K19]; [.$G$2] * [.K24]) -> 3.07447680192004 | L25: of:=IF([.$K$2]>0; [.$G$2] * [.L19]; [.$G$2] * [.L24]) -> 3.72599730050139 | M25: of:=IF([.$K$2]>0; [.$G$2] * [.M19]; [.$G$2] * [.M24]) -> 4.44035325995063 | N25: of:=IF([.$K$2]>0; [.$G$2] * [.N19]; [.$G$2] * [.N24]) -> 5.21757707597772 | O25: of:=IF([.$K$2]>0; [.$G$2] * [.O19]; [.$G$2] * [.O24]) -> 6.05769731993114 | P25: of:=IF([.$K$2]>0; [.$G$2] * [.P19]; [.$G$2] * [.P24]) -> 6.96073943712721 | Q25: of:=IF([.$K$2]>0; [.$G$2] * [.Q19]; [.$G$2] * [.Q24]) -> 7.92672627864938 | R25: of:=IF([.$K$2]>0; [.$G$2] * [.R19]; [.$G$2] * [.R24]) -> 0.080301412349322 | S25: of:=IF([.$K$2]>0; [.$G$2] * [.S19]; [.$G$2] * [.S24]) -> 0.0975518024503394 | T25: of:=IF([.$K$2]>0; [.$G$2] * [.T19]; [.$G$2] * [.T24]) -> 0.0852986882588238
A26: Generator Efficiency eta_max = | B26: of:=(1 - SQRT([.$I$4]*[.$E$4]/[.B23]))^2 -> 0.897210968626028 | C26: of:=(1 - SQRT([.$I$4]*[.$E$4]/[.C23]))^2 -> 0.92674006529786 | D26: of:=(1 - SQRT([.$I$4]*[.$E$4]/[.D23]))^2 -> 0.939974759456043 | E26: of:=(1 - SQRT([.$I$4]*[.$E$4]/[.E23]))^2 -> 0.947908846589829 | F26: of:=(1 - SQRT([.$I$4]*[.$E$4]/[.F23]))^2 -> 0.95334247443605 | G26: of:=(1 - SQRT([.$I$4]*[.$E$4]/[.G23]))^2 -> 0.957363374173678 | H26: of:=(1 - SQRT([.$I$4]*[.$E$4]/[.H23]))^2 -> 0.960494259384883 | I26: of:=(1 - SQRT([.$I$4]*[.$E$4]/[.I23]))^2 -> 0.963021713787338 | J26: of:=(1 - SQRT([.$I$4]*[.$E$4]/[.J23]))^2 -> 0.965117756010289 | K26: of:=(1 - SQRT([.$I$4]*[.$E$4]/[.K23]))^2 -> 0.966892724563145 | L26: of:=(1 - SQRT([.$I$4]*[.$E$4]/[.L23]))^2 -> 0.968421087044614 | M26: of:=(1 - SQRT([.$I$4]*[.$E$4]/[.M23]))^2 -> 0.969755167153626 | N26: of:=(1 - SQRT([.$I$4]*[.$E$4]/[.N23]))^2 -> 0.970932951968704 | O26: of:=(1 - SQRT([.$I$4]*[.$E$4]/[.O23]))^2 -> 0.971982778117253 | P26: of:=(1 - SQRT([.$I$4]*[.$E$4]/[.P23]))^2 -> 0.972926271933841 | Q26: of:=(1 - SQRT([.$I$4]*[.$E$4]/[.Q23]))^2 -> 0.973780263864119 | R26: of:=(1 - SQRT([.$I$4]*[.$E$4]/[.R23]))^2 -> 0.919667459495449 | S26: of:=(1 - SQRT([.$I$4]*[.$E$4]/[.S23]))^2 -> 0.923331313446647 | T26: of:=(1 - SQRT([.$I$4]*[.$E$4]/[.T23]))^2 -> 0.920821687800935 | U26: of:= [.C$30] / [.$G$4] / [.$G$4] -> 0.00712649453522132 | V26: P_loss = P_0 / U_0^2 not working here due to power not being kept constant!?
A27: Generator P_ohmic_loss (@high current, load dependent) | B27: of:=[.$E$4] * [.B24] * [.B24] -> 2.44546953966418 | C27: of:=[.$E$4] * [.C24] * [.C24] -> 41.7454329805913 | D27: of:=[.$E$4] * [.D24] * [.D24] -> 217.415504612757 | E27: of:=[.$E$4] * [.E24] * [.E24] -> 698.789269328215 | F27: of:=[.$E$4] * [.F24] * [.F24] -> 1725.64322909095 | G27: of:=[.$E$4] * [.G24] * [.G24] -> 3608.54169698714 | H27: of:=[.$E$4] * [.H24] * [.H24] -> 6729.06643803863 | I27: of:=[.$E$4] * [.I24] * [.I24] -> 11539.9842501283 | J27: of:=[.$E$4] * [.J24] * [.J24] -> 18565.3763858944 | K27: of:=[.$E$4] * [.K24] * [.K24] -> 28400.7424728744 | L27: of:=[.$E$4] * [.L24] * [.L24] -> 41713.0863726285 | M27: of:=[.$E$4] * [.M24] * [.M24] -> 59240.988686477 | N27: of:=[.$E$4] * [.N24] * [.N24] -> 81794.669054543 | O27: of:=[.$E$4] * [.O24] * [.O24] -> 110256.040443429 | P27: of:=[.$E$4] * [.P24] * [.P24] -> 145578.757007718 | Q27: of:=[.$E$4] * [.Q24] * [.Q24] -> 188788.256702758 | R27: of:=[.$E$4] * [.R24] * [.R24] -> 19.3746390529444 | S27: of:=[.$E$4] * [.S24] * [.S24] -> 28.592876555334 | T27: of:=[.$E$4] * [.T24] * [.T24] -> 21.861097338047
A28: Generator P_iron_loss if iron core (@I_0, i.e. low current, often at low speed, load independent) | B28: of:=[.B23]*[.$I$4] -> 20.6384172454415 | C28: of:=[.C23]*[.$I$4] -> 41.2768344908831 | D28: of:=[.D23]*[.$I$4] -> 61.9152517363246 | E28: of:=[.E23]*[.$I$4] -> 82.5536689817661 | F28: of:=[.F23]*[.$I$4] -> 103.192086227208 | G28: of:=[.G23]*[.$I$4] -> 123.830503472649 | H28: of:=[.H23]*[.$I$4] -> 144.468920718091 | I28: of:=[.I23]*[.$I$4] -> 165.107337963532 | J28: of:=[.J23]*[.$I$4] -> 185.745755208974 | K28: of:=[.K23]*[.$I$4] -> 206.384172454415 | L28: of:=[.L23]*[.$I$4] -> 227.022589699857 | M28: of:=[.M23]*[.$I$4] -> 247.661006945298 | N28: of:=[.N23]*[.$I$4] -> 268.29942419074 | O28: of:=[.O23]*[.$I$4] -> 288.937841436181 | P28: of:=[.P23]*[.$I$4] -> 309.576258681623 | Q28: of:=[.Q23]*[.$I$4] -> 330.214675927064 | R28: of:=[.R23]*[.$I$4] -> 34.2 | S28: of:=[.S23]*[.$I$4] -> 37.62 | T28: of:=[.T23]*[.$I$4] -> 35.226 | U28: of:=CONCATENATE("=>  Due to i_0 also pulling efficiency to zero at low currents while r_i pulls down"; CHAR(10);" at high currents, the peak efficiency will be inbetween (see eta_max above).") -> =>  Due to i_0 also pulling efficiency to zero at low currents while r_i pulls down
 at high currents, the peak efficiency will be inbetween (see eta_max above).
A29: P_Generator/P_Nominal | B29: of:=[.B$30] / [.$F$4] -> 0.0371659195029328 | C29: of:=[.C$30] / [.$F$4] -> 0.343021936961986 | D29: of:=[.D$30] / [.$F$4] -> 1 | E29: of:=[.E$30] / [.$F$4] -> 1 | F29: of:=[.F$30] / [.$F$4] -> 1 | G29: of:=[.G$30] / [.$F$4] -> 1 | H29: of:=[.H$30] / [.$F$4] -> 1 | I29: of:=[.I$30] / [.$F$4] -> 1 | J29: of:=[.J$30] / [.$F$4] -> 1 | K29: of:=[.K$30] / [.$F$4] -> 1 | L29: of:=[.L$30] / [.$F$4] -> 1 | M29: of:=[.M$30] / [.$F$4] -> 1 | N29: of:=[.N$30] / [.$F$4] -> 1 | O29: of:=[.O$30] / [.$F$4] -> 1 | P29: of:=[.P$30] / [.$F$4] -> 1 | Q29: of:=[.Q$30] / [.$F$4] -> 1 | R29: of:=[.R$30] / [.$F$4] -> 0 | S29: of:=[.S$30] / [.$F$4] -> 0 | T29: of:=[.T$30] / [.$F$4] -> 0 | U29: ← Auslastung / Generator capacity usage. Red is only tolerable to a certain degree. At some point the mechanic will break, even if the rotor is electrically/mechanically deccelerated to not go over the rated RPM.
A30: P_Gen._time_averaged / W | B30: of:=IF([.B$23] * [.B$24]- [.B$27]-[.B$28] > [.$F$4]; [.$F$4]; IF([.B$23] * [.B$24] - [.B$27] - [.B$28] < 0; 0; [.B$23]*[.B$24]-[.B$27]-[.B$28])) -> 111.497758508799 | C30: of:=IF([.C$23] * [.C$24]- [.C$27]-[.C$28] > [.$F$4]; [.$F$4]; IF([.C$23] * [.C$24] - [.C$27] - [.C$28] < 0; 0; [.C$23]*[.C$24]-[.C$27]-[.C$28])) -> 1029.06581088596 | D30: of:=IF([.D$23] * [.D$24]- [.D$27]-[.D$28] > [.$F$4]; [.$F$4]; IF([.D$23] * [.D$24] - [.D$27] - [.D$28] < 0; 0; [.D$23]*[.D$24]-[.D$27]-[.D$28])) -> 3000 | E30: of:=IF([.E$23] * [.E$24]- [.E$27]-[.E$28] > [.$F$4]; [.$F$4]; IF([.E$23] * [.E$24] - [.E$27] - [.E$28] < 0; 0; [.E$23]*[.E$24]-[.E$27]-[.E$28])) -> 3000 | F30: of:=IF([.F$23] * [.F$24]- [.F$27]-[.F$28] > [.$F$4]; [.$F$4]; IF([.F$23] * [.F$24] - [.F$27] - [.F$28] < 0; 0; [.F$23]*[.F$24]-[.F$27]-[.F$28])) -> 3000 | G30: of:=IF([.G$23] * [.G$24]- [.G$27]-[.G$28] > [.$F$4]; [.$F$4]; IF([.G$23] * [.G$24] - [.G$27] - [.G$28] < 0; 0; [.G$23]*[.G$24]-[.G$27]-[.G$28])) -> 3000 | H30: of:=IF([.H$23] * [.H$24]- [.H$27]-[.H$28] > [.$F$4]; [.$F$4]; IF([.H$23] * [.H$24] - [.H$27] - [.H$28] < 0; 0; [.H$23]*[.H$24]-[.H$27]-[.H$28])) -> 3000 | I30: of:=IF([.I$23] * [.I$24]- [.I$27]-[.I$28] > [.$F$4]; [.$F$4]; IF([.I$23] * [.I$24] - [.I$27] - [.I$28] < 0; 0; [.I$23]*[.I$24]-[.I$27]-[.I$28])) -> 3000 | J30: of:=IF([.J$23] * [.J$24]- [.J$27]-[.J$28] > [.$F$4]; [.$F$4]; IF([.J$23] * [.J$24] - [.J$27] - [.J$28] < 0; 0; [.J$23]*[.J$24]-[.J$27]-[.J$28])) -> 3000 | K30: of:=IF([.K$23] * [.K$24]- [.K$27]-[.K$28] > [.$F$4]; [.$F$4]; IF([.K$23] * [.K$24] - [.K$27] - [.K$28] < 0; 0; [.K$23]*[.K$24]-[.K$27]-[.K$28])) -> 3000 | L30: of:=IF([.L$23] * [.L$24]- [.L$27]-[.L$28] > [.$F$4]; [.$F$4]; IF([.L$23] * [.L$24] - [.L$27] - [.L$28] < 0; 0; [.L$23]*[.L$24]-[.L$27]-[.L$28])) -> 3000 | M30: of:=IF([.M$23] * [.M$24]- [.M$27]-[.M$28] > [.$F$4]; [.$F$4]; IF([.M$23] * [.M$24] - [.M$27] - [.M$28] < 0; 0; [.M$23]*[.M$24]-[.M$27]-[.M$28])) -> 3000 | N30: of:=IF([.N$23] * [.N$24]- [.N$27]-[.N$28] > [.$F$4]; [.$F$4]; IF([.N$23] * [.N$24] - [.N$27] - [.N$28] < 0; 0; [.N$23]*[.N$24]-[.N$27]-[.N$28])) -> 3000 | O30: of:=IF([.O$23] * [.O$24]- [.O$27]-[.O$28] > [.$F$4]; [.$F$4]; IF([.O$23] * [.O$24] - [.O$27] - [.O$28] < 0; 0; [.O$23]*[.O$24]-[.O$27]-[.O$28])) -> 3000 | P30: of:=IF([.P$23] * [.P$24]- [.P$27]-[.P$28] > [.$F$4]; [.$F$4]; IF([.P$23] * [.P$24] - [.P$27] - [.P$28] < 0; 0; [.P$23]*[.P$24]-[.P$27]-[.P$28])) -> 3000 | Q30: of:=IF([.Q$23] * [.Q$24]- [.Q$27]-[.Q$28] > [.$F$4]; [.$F$4]; IF([.Q$23] * [.Q$24] - [.Q$27] - [.Q$28] < 0; 0; [.Q$23]*[.Q$24]-[.Q$27]-[.Q$28])) -> 3000 | U30: ← Assumes the generator is prevented to generate more than its design power. (see red alert background in the power / power_nominal ratio above)
A31: P_All Generators / W | B31: of:=[.B30] * [.$C$4] -> 111.497758508799 | C31: of:=[.C30] * [.$C$4] -> 1029.06581088596 | D31: of:=[.D30] * [.$C$4] -> 3000 | E31: of:=[.E30] * [.$C$4] -> 3000 | F31: of:=[.F30] * [.$C$4] -> 3000 | G31: of:=[.G30] * [.$C$4] -> 3000 | H31: of:=[.H30] * [.$C$4] -> 3000 | I31: of:=[.I30] * [.$C$4] -> 3000 | J31: of:=[.J30] * [.$C$4] -> 3000 | K31: of:=[.K30] * [.$C$4] -> 3000 | L31: of:=[.L30] * [.$C$4] -> 3000 | M31: of:=[.M30] * [.$C$4] -> 3000 | N31: of:=[.N30] * [.$C$4] -> 3000 | O31: of:=[.O30] * [.$C$4] -> 3000 | P31: of:=[.P30] * [.$C$4] -> 3000 | Q31: of:=[.Q30] * [.$C$4] -> 3000 | R31: Gen.Tolerated Min.Efficiency:
A32: Output Power / W | B32: of:=IF([.B$12] = 0; 0; IF([.B14]<[.B31];[.B14];[.B31]) ) -> 111.497758508799 | C32: of:=IF([.C$12] = 0; 0; IF([.C14]<[.C31];[.C14];[.C31]) ) -> 1029.06581088596 | D32: of:=IF([.D$12] = 0; 0; IF([.D14]<[.D31];[.D14];[.D31]) ) -> 3000 | E32: of:=IF([.E$12] = 0; 0; IF([.E14]<[.E31];[.E14];[.E31]) ) -> 0 | F32: of:=IF([.F$12] = 0; 0; IF([.F14]<[.F31];[.F14];[.F31]) ) -> 0 | G32: of:=IF([.G$12] = 0; 0; IF([.G14]<[.G31];[.G14];[.G31]) ) -> 0 | H32: of:=IF([.H$12] = 0; 0; IF([.H14]<[.H31];[.H14];[.H31]) ) -> 0 | I32: of:=IF([.I$12] = 0; 0; IF([.I14]<[.I31];[.I14];[.I31]) ) -> 0 | J32: of:=IF([.J$12] = 0; 0; IF([.J14]<[.J31];[.J14];[.J31]) ) -> 0 | K32: of:=IF([.K$12] = 0; 0; IF([.K14]<[.K31];[.K14];[.K31]) ) -> 0 | L32: of:=IF([.L$12] = 0; 0; IF([.L14]<[.L31];[.L14];[.L31]) ) -> 0 | M32: of:=IF([.M$12] = 0; 0; IF([.M14]<[.M31];[.M14];[.M31]) ) -> 0 | N32: of:=IF([.N$12] = 0; 0; IF([.N14]<[.N31];[.N14];[.N31]) ) -> 0 | O32: of:=IF([.O$12] = 0; 0; IF([.O14]<[.O31];[.O14];[.O31]) ) -> 0 | P32: of:=IF([.P$12] = 0; 0; IF([.P14]<[.P31];[.P14];[.P31]) ) -> 0 | Q32: of:=IF([.Q$12] = 0; 0; IF([.Q14]<[.Q31];[.Q14];[.Q31]) ) -> 0 | R32: Efficiency eta_min_tolerated = | S32: 0.5
A33: Gen. Energy / Wh/d | B33: of:=24 * [.B12] * [.B32] -> 2140.75696336893 | C33: of:=24 * [.C12] * [.C32] -> 3704.63691918945 | D33: of:=24 * [.D12] * [.D32] -> 3600 | E33: of:=24 * [.E12] * [.E32] -> 0 | F33: of:=24 * [.F12] * [.F32] -> 0 | G33: of:=24 * [.G12] * [.G32] -> 0 | H33: of:=24 * [.H12] * [.H32] -> 0 | I33: of:=24 * [.I12] * [.I32] -> 0 | J33: of:=24 * [.J12] * [.J32] -> 0 | K33: of:=24 * [.K12] * [.K32] -> 0 | L33: of:=24 * [.L12] * [.L32] -> 0 | M33: of:=24 * [.M12] * [.M32] -> 0 | N33: of:=24 * [.N12] * [.N32] -> 0 | O33: of:=24 * [.O12] * [.O32] -> 0 | P33: of:=24 * [.P12] * [.P32] -> 0 | Q33: of:=24 * [.Q12] * [.Q32] -> 0 | R33: Gen.Theo.Max.Efficiency:
A34: Generator active cut in / off | B34: 0 | C34: 0 | D34: 0 | E34: 1 | F34: 1 | G34: 1 | H34: 1 | I34: 1 | J34: 1 | K34: 1 | L34: 1 | M34: 1 | N34: 1 | O34: 1 | P34: 1 | Q34: 1 | R34: Efficiency eta_max = | S34: of:=(1 - SQRT([.$I$4]*[.$E$4]/[.$G$4]))^2 -> 0.919667459495449
A35: Extracted E / Wh/d | B35: of:=([.B33]*[.B34]) -> 0 | C35: of:=([.C33]*[.C34]) -> 0 | D35: of:=([.D33]*[.D34]) -> 0 | E35: of:=([.E33]*[.E34]) -> 0 | F35: of:=([.F33]*[.F34]) -> 0 | G35: of:=([.G33]*[.G34]) -> 0 | H35: of:=([.H33]*[.H34]) -> 0 | I35: of:=([.I33]*[.I34]) -> 0 | J35: of:=([.J33]*[.J34]) -> 0 | K35: of:=([.K33]*[.K34]) -> 0 | L35: of:=([.L33]*[.L34]) -> 0 | M35: of:=([.M33]*[.M34]) -> 0 | N35: of:=([.N33]*[.N34]) -> 0 | O35: of:=([.O33]*[.O34]) -> 0 | P35: of:=([.P33]*[.P34]) -> 0 | Q35: of:=([.Q33]*[.Q34]) -> 0 | R35: I_@eta_max = | S35: of:=SQRT([.$G$4]*[.$I$4]/[.$E$4]) -> 2.19474404167108 | T35: A
A36: ONLY CONSTRUCT A WIND POWER PLANT IF YOU HAVE HIGH WINDS! IT'S NOT A MIRACLE MACHINE. NO WIND => NO POWER OUTPUT!
S41: Flow
R42: KWh/Day | S42: MWh / year
R43: of:=SUM([.B13:.Q13])/1000 -> 40.2 | S43: of:=(SUM([.B13:.Q13])*365.25)/1000/1000 -> 14.68305
S45: Turbine
R46: Wh / Day | S46: KWh / month
R47: of:=SUM([.B15:.Q15]) -> 12060 | S47: of:=([.R47]*30)/1000 -> 361.8
R48: of:=ROUND(([.R47]/1000);2)&"KWh" -> 12.06KWh | S48: /Day
R49: W / h | S49: MWh / year
R50: of:=[.R47]/24 -> 502.5 | S50: of:=([.R47]*365.25)/1000/1000 -> 4.404915
R52: of:=([.B33]*[.B34])+([.C33]*[.C34])+([.D33]*[.D34])+([.E33]*[.E34])+([.F33]*[.F34])+([.G33]*[.G34])+([.H33]*[.H34])+([.I33]*[.I34])+([.J33]*[.J34])+([.K33]*[.K34])+([.L33]*[.L34])+([.M33]*[.M34])+([.N33]*[.N34])+([.O33]*[.O34])+([.P33]*[.P34])+([.Q33]*[.Q34]) -> 0 | S52: of:=SUM([.B33:.Q33]) -> 9445.39388255838
R53: of:=[.R52]/[.S52] -> 0 | S53: Generator
R54: Wh / Day | S54: KWh / month
R55: of:=SUM([.B35:.Q35]) -> 0 | S55: of:=([.R55]*30)/1000 -> 0
R56: of:=ROUND(([.R55]/1000);2)&"KWh" -> 0KWh | S56: /Day
R57: W / h | S57: MWh / year
R58: of:=[.R55]/24 -> 0 | S58: of:=([.R55]*365.25)/1000/1000 -> 0
A253: Efficiency [%] | B253: 0.2 | C253: Specifications: | D253: 0.7 | E253: KV-Number | F253: Radagast | H253: Extended Version | K253: Electrodacus | N253: Only input data on cells with this color.
A254: Air density | B254: 1.2 | C254: V_Nomi | D254: V/kRPM | E254: Ri [ohm] | F254: P_Nominal | H254: Power Factor | O254: Use [%] | P254: of:=([.S281]/SUM([.B265:.Q265])) -> 0 | Q254: Wind-E
A255: Number of E Gen | B255: 1 | C255: 480 | D255: of:=[.C255]/[.D253] -> 685.714285714286 | E255: 7.1 | F255: 3000 | G255: W | H255: 0.87 | J255: Savonius Wind Turbine Calculator | O255: Use [%] | P255: of:=([.R281]/SUM([.B267:.Q267])) -> 0 | Q255: Turbine-E
A256: Speed ratio | B256: 1 | C256: 7.2km/h | D256: 10.8km/h | E256: 14.4km/h | F256: 18km/h | G256: 21.6km/h | H256: 25.2km/h | I256: 28.8km/h | J256: 32.4km/h | K256: 36km/h | L256: 39.6km/h | M256: 43.2km/h | N256: 46.8km/h | O256: 50.4km/h | P256: 54km/h | Q256: 57.6km/h
A257: Wind speed [m/s] | B257: 1 | C257: 2 | D257: 3 | E257: 4 | F257: 5 | G257: 6 | H257: 7 | I257: 8 | J257: 9 | K257: 10 | L257: 11 | M257: 12 | N257: 13 | O257: 14 | P257: 15 | Q257: 16
A258: Diameter [m] → | B258: 5 | C258: of:=[.$B$258] -> 5 | D258: of:=[.$B$258] -> 5 | E258: of:=[.$B$258] -> 5 | F258: of:=[.$B$258] -> 5 | G258: of:=[.$B$258] -> 5 | H258: of:=[.$B$258] -> 5 | I258: of:=[.$B$258] -> 5 | J258: of:=[.$B$258] -> 5 | K258: of:=[.$B$258] -> 5 | L258: of:=[.$B$258] -> 5 | M258: of:=[.$B$258] -> 5 | N258: of:=[.$B$258] -> 5 | O258: of:=[.$B$258] -> 5 | P258: of:=[.$B$258] -> 5 | Q258: of:=[.$B$258] -> 5
A259: Height [m] → | B259: 6 | C259: of:=[.$B$259] -> 6 | D259: of:=[.$B$259] -> 6 | E259: of:=[.$B$259] -> 6 | F259: of:=[.$B$259] -> 6 | G259: of:=[.$B$259] -> 6 | H259: of:=[.$B$259] -> 6 | I259: of:=[.$B$259] -> 6 | J259: of:=[.$B$259] -> 6 | K259: of:=[.$B$259] -> 6 | L259: of:=[.$B$259] -> 6 | M259: of:=[.$B$259] -> 6 | N259: of:=[.$B$259] -> 6 | O259: of:=[.$B$259] -> 6 | P259: of:=[.$B$259] -> 6 | Q259: of:=[.$B$259] -> 6
A260: T_period_ @1RPM | B260: of:=60/(([.B258]*3.14)/[.B257]) -> 3.82165605095541 | C260: of:=60/(([.C258]*3.14)/[.C257]) -> 7.64331210191083 | D260: of:=60/(([.D258]*3.14)/[.D257]) -> 11.4649681528662 | E260: of:=60/(([.E258]*3.14)/[.E257]) -> 15.2866242038217 | F260: of:=60/(([.F258]*3.14)/[.F257]) -> 19.1082802547771 | G260: of:=60/(([.G258]*3.14)/[.G257]) -> 22.9299363057325 | H260: of:=60/(([.H258]*3.14)/[.H257]) -> 26.7515923566879 | I260: of:=60/(([.I258]*3.14)/[.I257]) -> 30.5732484076433 | J260: of:=60/(([.J258]*3.14)/[.J257]) -> 34.3949044585987 | K260: of:=60/(([.K258]*3.14)/[.K257]) -> 38.2165605095541 | L260: of:=60/(([.L258]*3.14)/[.L257]) -> 42.0382165605095 | M260: of:=60/(([.M258]*3.14)/[.M257]) -> 45.859872611465 | N260: of:=60/(([.N258]*3.14)/[.N257]) -> 49.6815286624204 | O260: of:=60/(([.O258]*3.14)/[.O257]) -> 53.5031847133758 | P260: of:=60/(([.P258]*3.14)/[.P257]) -> 57.3248407643312 | Q260: of:=60/(([.Q258]*3.14)/[.Q257]) -> 61.1464968152866
A261: 1 | B261: of:=[.B260]*[.$A$261] -> 3.82165605095541 | C261: of:=[.C260]*[.$A$261] -> 7.64331210191083 | D261: of:=[.D260]*[.$A$261] -> 11.4649681528662 | E261: of:=[.E260]*[.$A$261] -> 15.2866242038217 | F261: of:=[.F260]*[.$A$261] -> 19.1082802547771 | G261: of:=[.G260]*[.$A$261] -> 22.9299363057325 | H261: of:=[.H260]*[.$A$261] -> 26.7515923566879 | I261: of:=[.I260]*[.$A$261] -> 30.5732484076433 | J261: of:=[.J260]*[.$A$261] -> 34.3949044585987 | K261: of:=[.K260]*[.$A$261] -> 38.2165605095541 | L261: of:=[.L260]*[.$A$261] -> 42.0382165605095 | M261: of:=[.M260]*[.$A$261] -> 45.859872611465 | N261: of:=[.N260]*[.$A$261] -> 49.6815286624204 | O261: of:=[.O260]*[.$A$261] -> 53.5031847133758 | P261: of:=[.P260]*[.$A$261] -> 57.3248407643312 | Q261: of:=[.Q260]*[.$A$261] -> 61.1464968152866
A262: Gen speed RPM | B262: of:=[.B261]*[.$B$256] -> 3.82165605095541 | C262: of:=[.C261]*[.$B$256] -> 7.64331210191083 | D262: of:=[.D261]*[.$B$256] -> 11.4649681528662 | E262: of:=[.E261]*[.$B$256] -> 15.2866242038217 | F262: of:=[.F261]*[.$B$256] -> 19.1082802547771 | G262: of:=[.G261]*[.$B$256] -> 22.9299363057325 | H262: of:=[.H261]*[.$B$256] -> 26.7515923566879 | I262: of:=[.I261]*[.$B$256] -> 30.5732484076433 | J262: of:=[.J261]*[.$B$256] -> 34.3949044585987 | K262: of:=[.K261]*[.$B$256] -> 38.2165605095541 | L262: of:=[.L261]*[.$B$256] -> 42.0382165605095 | M262: of:=[.M261]*[.$B$256] -> 45.859872611465 | N262: of:=[.N261]*[.$B$256] -> 49.6815286624204 | O262: of:=[.O261]*[.$B$256] -> 53.5031847133758 | P262: of:=[.P261]*[.$B$256] -> 57.3248407643312 | Q262: of:=[.Q261]*[.$B$256] -> 61.1464968152866
A263: Power Wind | B263: of:=0.5*[.$B$254]*([.$B$258]*[.$B$259])*([.B257]^3) -> 18 | C263: of:=0.5*[.$B$254]*([.$B$258]*[.$B$259])*([.C257]^3) -> 144 | D263: of:=0.5*[.$B$254]*([.$B$258]*[.$B$259])*([.D257]^3) -> 486 | E263: of:=0.5*[.$B$254]*([.$B$258]*[.$B$259])*([.E257]^3) -> 1152 | F263: of:=0.5*[.$B$254]*([.$B$258]*[.$B$259])*([.F257]^3) -> 2250 | G263: of:=0.5*[.$B$254]*([.$B$258]*[.$B$259])*([.G257]^3) -> 3888 | H263: of:=0.5*[.$B$254]*([.$B$258]*[.$B$259])*([.H257]^3) -> 6174 | I263: of:=0.5*[.$B$254]*([.$B$258]*[.$B$259])*([.I257]^3) -> 9216 | J263: of:=0.5*[.$B$254]*([.$B$258]*[.$B$259])*([.J257]^3) -> 13122 | K263: of:=0.5*[.$B$254]*([.$B$258]*[.$B$259])*([.K257]^3) -> 18000 | L263: of:=0.5*[.$B$254]*([.$B$258]*[.$B$259])*([.L257]^3) -> 23958 | M263: of:=0.5*[.$B$254]*([.$B$258]*[.$B$259])*([.M257]^3) -> 31104 | N263: of:=0.5*[.$B$254]*([.$B$258]*[.$B$259])*([.N257]^3) -> 39546 | O263: of:=0.5*[.$B$254]*([.$B$258]*[.$B$259])*([.O257]^3) -> 49392 | P263: of:=0.5*[.$B$254]*([.$B$258]*[.$B$259])*([.P257]^3) -> 60750 | Q263: of:=0.5*[.$B$254]*([.$B$258]*[.$B$259])*([.Q257]^3) -> 73728
A264: Tages-Wind % | B264: of:=0.014 -> 0.014 | C264: of:=0.0623169 -> 0.0623169 | D264: of:=0.113373 -> 0.113373 | E264: of:=0.138794 -> 0.138794 | F264: of:=0.139221 -> 0.139221 | G264: of:=0.146362 -> 0.146362 | H264: of:=0.102081 -> 0.102081 | I264: of:=0.0926514 -> 0.0926514 | J264: of:=0.0618896 -> 0.0618896 | K264: of:=0.0334473 -> 0.0334473 | L264: of:=0.0307617 -> 0.0307617 | M264: of:=0.0274963 -> 0.0274963 | N264: of:=0.0117188 -> 0.0117188 | O264: of:=0.0109253 -> 0.0109253 | P264: of:=0.00369263 -> 0.00369263 | Q264: of:=0.00552368 -> 0.00552368
A265: Wind Energy / Wh/d | B265: of:=24 * [.B264] * [.B263] -> 6.048 | C265: of:=24 * [.C264] * [.C263] -> 215.3672064 | D265: of:=24 * [.D264] * [.D263] -> 1322.382672 | E265: of:=24 * [.E264] * [.E263] -> 3837.376512 | F265: of:=24 * [.F264] * [.F263] -> 7517.934 | G265: of:=24 * [.G264] * [.G263] -> 13657.330944 | H265: of:=24 * [.H264] * [.H263] -> 15125.954256 | I265: of:=24 * [.I264] * [.I263] -> 20493.0072576 | J265: of:=24 * [.J264] * [.J263] -> 19490.7679488 | K265: of:=24 * [.K264] * [.K263] -> 14449.2336 | L265: of:=24 * [.L264] * [.L263] -> 17687.7314064 | M265: of:=24 * [.M264] * [.M263] -> 20525.8779648 | N265: of:=24 * [.N264] * [.N263] -> 11122.3599552 | O265: of:=24 * [.O264] * [.O263] -> 12950.9380224 | P265: of:=24 * [.P264] * [.P263] -> 5383.85454 | Q265: of:=24 * [.Q264] * [.Q263] -> 9773.99709696
A266: Turbine Power/W | B266: of:=[.B263]*[.$B$253] -> 3.6 | C266: of:=[.C263]*[.$B$253] -> 28.8 | D266: of:=[.D263]*[.$B$253] -> 97.2 | E266: of:=[.E263]*[.$B$253] -> 230.4 | F266: of:=[.F263]*[.$B$253] -> 450 | G266: of:=[.G263]*[.$B$253] -> 777.6 | H266: of:=[.H263]*[.$B$253] -> 1234.8 | I266: of:=[.I263]*[.$B$253] -> 1843.2 | J266: of:=[.J263]*[.$B$253] -> 2624.4 | K266: of:=[.K263]*[.$B$253] -> 3600 | L266: of:=[.L263]*[.$B$253] -> 4791.6 | M266: of:=[.M263]*[.$B$253] -> 6220.8 | N266: of:=[.N263]*[.$B$253] -> 7909.2 | O266: of:=[.O263]*[.$B$253] -> 9878.4 | P266: of:=[.P263]*[.$B$253] -> 12150 | Q266: of:=[.Q263]*[.$B$253] -> 14745.6
A267: Turbine Energy Wh/d | B267: of:=24 * [.B264] * [.B266] -> 1.2096 | C267: of:=24 * [.C264] * [.C266] -> 43.07344128 | D267: of:=24 * [.D264] * [.D266] -> 264.4765344 | E267: of:=24 * [.E264] * [.E266] -> 767.4753024 | F267: of:=24 * [.F264] * [.F266] -> 1503.5868 | G267: of:=24 * [.G264] * [.G266] -> 2731.4661888 | H267: of:=24 * [.H264] * [.H266] -> 3025.1908512 | I267: of:=24 * [.I264] * [.I266] -> 4098.60145152 | J267: of:=24 * [.J264] * [.J266] -> 3898.15358976 | K267: of:=24 * [.K264] * [.K266] -> 2889.84672 | L267: of:=24 * [.L264] * [.L266] -> 3537.54628128 | M267: of:=24 * [.M264] * [.M266] -> 4105.17559296 | N267: of:=24 * [.N264] * [.N266] -> 2224.47199104 | O267: of:=24 * [.O264] * [.O266] -> 2590.18760448 | P267: of:=24 * [.P264] * [.P266] -> 1076.770908 | Q267: of:=24 * [.Q264] * [.Q266] -> 1954.799419392
A268: P_Generator/P_Nominal | B268: of:=[.B$269] * [.B$270] / [.$F$255] -> 0.000322411101418384 | C268: of:=[.C$269] * [.C$270] / [.$F$255] -> 0.00128964440567353 | D268: of:=[.D$269] * [.D$270] / [.$F$255] -> 0.00290169991276545 | E268: of:=[.E$269] * [.E$270] / [.$F$255] -> 0.00515857762269414 | F268: of:=[.F$269] * [.F$270] / [.$F$255] -> 0.00806027753545959 | G268: of:=[.G$269] * [.G$270] / [.$F$255] -> 0.0116067996510618 | H268: of:=[.H$269] * [.H$270] / [.$F$255] -> 0.0157981439695008 | I268: of:=[.I$269] * [.I$270] / [.$F$255] -> 0.0206343104907766 | J268: of:=[.J$269] * [.J$270] / [.$F$255] -> 0.0261152992148891 | K268: of:=[.K$269] * [.K$270] / [.$F$255] -> 0.0322411101418384 | L268: of:=[.L$269] * [.L$270] / [.$F$255] -> 0.0390117432716244 | M268: of:=[.M$269] * [.M$270] / [.$F$255] -> 0.0464271986042473 | N268: of:=[.N$269] * [.N$270] / [.$F$255] -> 0.0544874761397068 | O268: of:=[.O$269] * [.O$270] / [.$F$255] -> 0.0631925758780032 | P268: of:=[.P$269] * [.P$270] / [.$F$255] -> 0.0725424978191363 | Q268: of:=[.Q$269] * [.Q$270] / [.$F$255] -> 0.0825372419631062
A269: Voltage @xRPM / V | B269: of:=([.B262]*[.$D$255]/1000) -> 2.62056414922657 | C269: of:=([.C262]*[.$D$255]/1000) -> 5.24112829845314 | D269: of:=([.D262]*[.$D$255]/1000) -> 7.86169244767971 | E269: of:=([.E262]*[.$D$255]/1000) -> 10.4822565969063 | F269: of:=([.F262]*[.$D$255]/1000) -> 13.1028207461328 | G269: of:=([.G262]*[.$D$255]/1000) -> 15.7233848953594 | H269: of:=([.H262]*[.$D$255]/1000) -> 18.343949044586 | I269: of:=([.I262]*[.$D$255]/1000) -> 20.9645131938126 | J269: of:=([.J262]*[.$D$255]/1000) -> 23.5850773430391 | K269: of:=([.K262]*[.$D$255]/1000) -> 26.2056414922657 | L269: of:=([.L262]*[.$D$255]/1000) -> 28.8262056414923 | M269: of:=([.M262]*[.$D$255]/1000) -> 31.4467697907188 | N269: of:=([.N262]*[.$D$255]/1000) -> 34.0673339399454 | O269: of:=([.O262]*[.$D$255]/1000) -> 36.687898089172 | P269: of:=([.P262]*[.$D$255]/1000) -> 39.3084622383985 | Q269: of:=([.Q262]*[.$D$255]/1000) -> 41.9290263876251
A270: I_actual / Ampère | B270: of:=[.B$269]/[.$E$255] -> 0.369093542144587 | C270: of:=[.C$269]/[.$E$255] -> 0.738187084289174 | D270: of:=[.D$269]/[.$E$255] -> 1.10728062643376 | E270: of:=[.E$269]/[.$E$255] -> 1.47637416857835 | F270: of:=[.F$269]/[.$E$255] -> 1.84546771072294 | G270: of:=[.G$269]/[.$E$255] -> 2.21456125286752 | H270: of:=[.H$269]/[.$E$255] -> 2.58365479501211 | I270: of:=[.I$269]/[.$E$255] -> 2.9527483371567 | J270: of:=[.J$269]/[.$E$255] -> 3.32184187930129 | K270: of:=[.K$269]/[.$E$255] -> 3.69093542144587 | L270: of:=[.L$269]/[.$E$255] -> 4.06002896359046 | M270: of:=[.M$269]/[.$E$255] -> 4.42912250573505 | N270: of:=[.N$269]/[.$E$255] -> 4.79821604787963 | O270: of:=[.O$269]/[.$E$255] -> 5.16730959002422 | P270: of:=[.P$269]/[.$E$255] -> 5.53640313216881 | Q270: of:=[.Q$269]/[.$E$255] -> 5.9054966743134
A271: Generator P_loss | B271: of:=[.$F$255] / [.B$269] / [.B$269] -> 436.849320023148 | C271: of:=[.$F$255] / [.C$269] / [.C$269] -> 109.212330005787 | D271: of:=[.$F$255] / [.D$269] / [.D$269] -> 48.5388133359054 | E271: of:=[.$F$255] / [.E$269] / [.E$269] -> 27.3030825014468 | F271: of:=[.$F$255] / [.F$269] / [.F$269] -> 17.4739728009259 | G271: of:=[.$F$255] / [.G$269] / [.G$269] -> 12.1347033339763 | H271: of:=[.$F$255] / [.H$269] / [.H$269] -> 8.91529224537038 | I271: of:=[.$F$255] / [.I$269] / [.I$269] -> 6.82577062536169 | J271: of:=[.$F$255] / [.J$269] / [.J$269] -> 5.39320148176726 | K271: of:=[.$F$255] / [.K$269] / [.K$269] -> 4.36849320023148 | L271: of:=[.$F$255] / [.L$269] / [.L$269] -> 3.61032495886899 | M271: of:=[.$F$255] / [.M$269] / [.M$269] -> 3.03367583349409 | N271: of:=[.$F$255] / [.N$269] / [.N$269] -> 2.58490721907188 | O271: of:=[.$F$255] / [.O$269] / [.O$269] -> 2.22882306134259 | P271: of:=[.$F$255] / [.P$269] / [.P$269] -> 1.94155253343621 | Q271: of:=[.$F$255] / [.Q$269] / [.Q$269] -> 1.70644265634042
A272: Generator Power | B272: of:=IF([.B$269] * [.B$270]  * [.$H$255]>[.$F$255]; [.$F$255]; [.B$269] * [.B$270]  * [.$H$255]) -> 0.841492974701981 | C272: of:=IF([.C$269] * [.C$270]  * [.$H$255]>[.$F$255]; [.$F$255]; [.C$269] * [.C$270]  * [.$H$255]) -> 3.36597189880793 | D272: of:=IF([.D$269] * [.D$270]  * [.$H$255]>[.$F$255]; [.$F$255]; [.D$269] * [.D$270]  * [.$H$255]) -> 7.57343677231783 | E272: of:=IF([.E$269] * [.E$270]  * [.$H$255]>[.$F$255]; [.$F$255]; [.E$269] * [.E$270]  * [.$H$255]) -> 13.4638875952317 | F272: of:=IF([.F$269] * [.F$270]  * [.$H$255]>[.$F$255]; [.$F$255]; [.F$269] * [.F$270]  * [.$H$255]) -> 21.0373243675495 | G272: of:=IF([.G$269] * [.G$270]  * [.$H$255]>[.$F$255]; [.$F$255]; [.G$269] * [.G$270]  * [.$H$255]) -> 30.2937470892713 | H272: of:=IF([.H$269] * [.H$270]  * [.$H$255]>[.$F$255]; [.$F$255]; [.H$269] * [.H$270]  * [.$H$255]) -> 41.2331557603971 | I272: of:=IF([.I$269] * [.I$270]  * [.$H$255]>[.$F$255]; [.$F$255]; [.I$269] * [.I$270]  * [.$H$255]) -> 53.8555503809268 | J272: of:=IF([.J$269] * [.J$270]  * [.$H$255]>[.$F$255]; [.$F$255]; [.J$269] * [.J$270]  * [.$H$255]) -> 68.1609309508605 | K272: of:=IF([.K$269] * [.K$270]  * [.$H$255]>[.$F$255]; [.$F$255]; [.K$269] * [.K$270]  * [.$H$255]) -> 84.1492974701981 | L272: of:=IF([.L$269] * [.L$270]  * [.$H$255]>[.$F$255]; [.$F$255]; [.L$269] * [.L$270]  * [.$H$255]) -> 101.82064993894 | M272: of:=IF([.M$269] * [.M$270]  * [.$H$255]>[.$F$255]; [.$F$255]; [.M$269] * [.M$270]  * [.$H$255]) -> 121.174988357085 | N272: of:=IF([.N$269] * [.N$270]  * [.$H$255]>[.$F$255]; [.$F$255]; [.N$269] * [.N$270]  * [.$H$255]) -> 142.212312724635 | O272: of:=IF([.O$269] * [.O$270]  * [.$H$255]>[.$F$255]; [.$F$255]; [.O$269] * [.O$270]  * [.$H$255]) -> 164.932623041588 | P272: of:=IF([.P$269] * [.P$270]  * [.$H$255]>[.$F$255]; [.$F$255]; [.P$269] * [.P$270]  * [.$H$255]) -> 189.335919307946 | Q272: of:=IF([.Q$269] * [.Q$270]  * [.$H$255]>[.$F$255]; [.$F$255]; [.Q$269] * [.Q$270]  * [.$H$255]) -> 215.422201523707
A273: P_All Generators | B273: of:=[.B272] * [.$B$255] -> 0.841492974701981 | C273: of:=[.C272] * [.$B$255] -> 3.36597189880793 | D273: of:=[.D272] * [.$B$255] -> 7.57343677231783 | E273: of:=[.E272] * [.$B$255] -> 13.4638875952317 | F273: of:=[.F272] * [.$B$255] -> 21.0373243675495 | G273: of:=[.G272] * [.$B$255] -> 30.2937470892713 | H273: of:=[.H272] * [.$B$255] -> 41.2331557603971 | I273: of:=[.I272] * [.$B$255] -> 53.8555503809268 | J273: of:=[.J272] * [.$B$255] -> 68.1609309508605 | K273: of:=[.K272] * [.$B$255] -> 84.1492974701981 | L273: of:=[.L272] * [.$B$255] -> 101.82064993894 | M273: of:=[.M272] * [.$B$255] -> 121.174988357085 | N273: of:=[.N272] * [.$B$255] -> 142.212312724635 | O273: of:=[.O272] * [.$B$255] -> 164.932623041588 | P273: of:=[.P272] * [.$B$255] -> 189.335919307946 | Q273: of:=[.Q272] * [.$B$255] -> 215.422201523707
A274: Output Power / W | B274: of:=IF([.B266]<[.B273];[.B266];[.B273]) -> 0.841492974701981 | C274: of:=IF([.C266]<[.C273];[.C266];[.C273]) -> 3.36597189880793 | D274: of:=IF([.D266]<[.D273];[.D266];[.D273]) -> 7.57343677231783 | E274: of:=IF([.E266]<[.E273];[.E266];[.E273]) -> 13.4638875952317 | F274: of:=IF([.F266]<[.F273];[.F266];[.F273]) -> 21.0373243675495 | G274: of:=IF([.G266]<[.G273];[.G266];[.G273]) -> 30.2937470892713 | H274: of:=IF([.H266]<[.H273];[.H266];[.H273]) -> 41.2331557603971 | I274: of:=IF([.I266]<[.I273];[.I266];[.I273]) -> 53.8555503809268 | J274: of:=IF([.J266]<[.J273];[.J266];[.J273]) -> 68.1609309508605 | K274: of:=IF([.K266]<[.K273];[.K266];[.K273]) -> 84.1492974701981 | L274: of:=IF([.L266]<[.L273];[.L266];[.L273]) -> 101.82064993894 | M274: of:=IF([.M266]<[.M273];[.M266];[.M273]) -> 121.174988357085 | N274: of:=IF([.N266]<[.N273];[.N266];[.N273]) -> 142.212312724635 | O274: of:=IF([.O266]<[.O273];[.O266];[.O273]) -> 164.932623041588 | P274: of:=IF([.P266]<[.P273];[.P266];[.P273]) -> 189.335919307946 | Q274: of:=IF([.Q266]<[.Q273];[.Q266];[.Q273]) -> 215.422201523707
A275: Gen Energy / Wh/d | B275: of:=24 * [.B264] * [.B274] -> 0.282741639499866 | C275: of:=24 * [.C264] * [.C274] -> 5.03416642129977 | D275: of:=24 * [.D264] * [.D274] -> 20.6069579325117 | E275: of:=24 * [.E264] * [.E274] -> 44.8489635574221 | F275: of:=24 * [.F264] * [.F274] -> 70.2920960585907 | G275: of:=24 * [.G264] * [.G274] -> 106.412481875518 | H275: of:=24 * [.H264] * [.H274] -> 101.01892255625 | I275: of:=24 * [.I264] * [.I274] -> 119.755011373522 | J275: of:=24 * [.J264] * [.J274] -> 101.242866052233 | K275: of:=24 * [.K264] * [.K274] -> 67.549603134599 | L275: of:=24 * [.L264] * [.L274] -> 75.1722308934404 | M275: of:=24 * [.M264] * [.M274] -> 79.9647319767102 | N275: of:=24 * [.N264] * [.N274] -> 39.9973836085788 | O275: of:=24 * [.O264] * [.O274] -> 43.2465212763904 | P275: of:=24 * [.P264] * [.P274] -> 16.7795398971384 | Q275: of:=24 * [.Q264] * [.Q274] -> 28.5581593466993
A276: Generator active→ | B276: 0 | C276: 0 | D276: 1 | E276: 1 | F276: 1 | G276: 1 | H276: 1 | I276: 1 | J276: 1 | K276: 1 | L276: 1 | M276: 1 | N276: 1 | O276: 1 | P276: 1 | Q276: 1
A277: Extracted E / Wh/d | B277: of:=([.B275]*[.B276]) -> 0 | C277: of:=([.C275]*[.C276]) -> 0 | D277: of:=([.D275]*[.D276]) -> 20.6069579325117 | E277: of:=([.E275]*[.E276]) -> 44.8489635574221 | F277: of:=([.F275]*[.F276]) -> 70.2920960585907 | G277: of:=([.G275]*[.G276]) -> 106.412481875518 | H277: of:=([.H275]*[.H276]) -> 101.01892255625 | I277: of:=([.I275]*[.I276]) -> 119.755011373522 | J277: of:=([.J275]*[.J276]) -> 101.242866052233 | K277: of:=([.K275]*[.K276]) -> 67.549603134599 | L277: of:=([.L275]*[.L276]) -> 75.1722308934404 | M277: of:=([.M275]*[.M276]) -> 79.9647319767102 | N277: of:=([.N275]*[.N276]) -> 39.9973836085788 | O277: of:=([.O275]*[.O276]) -> 43.2465212763904 | P277: of:=([.P275]*[.P276]) -> 16.7795398971384 | Q277: of:=([.Q275]*[.Q276]) -> 28.5581593466993

Sheet: Motor
A1: Axial Flux Motor Design
A2: Motor:
A3: Motor radius/m = | B3: 0.25 | C3: of:="=>Motor circumverence/m =" -> =>Motor circumverence/m = | D3: of:=2 * [.B3] * PI() -> 1.5707963267949
C4: of:="=>Motor area/m^2 =" -> =>Motor area/m^2 = | D4: of:=[.B3] * [.B3] * PI() -> 0.196349540849362 | E4: BUILD THE MILL!
A6: Rotor:
A7: Pole location radius/m = | B7: of:=[.B3] /  3 * 2 -> 0.166666666666667 | C7: of:="=>Pole location circumverence/m =" -> =>Pole location circumverence/m = | D7: of:=2 * [.B7] * PI() -> 1.0471975511966 | E7: ← Assumes the poles are placed at 2/3 * radius.
A8: Pole spacing/m = | B8: 0.01 | G8: #poles_optimum= | I8: Pole width/m_optimum =
A10: EITHER: | B10: the higher the greater the 'reduction' => more torque
A11: Rotor Pole count = | B11: 20 | C11: of:="=>#pole pairs =" -> =>#pole pairs = | D11: of:=[.B11]/2 -> 10 | E11: of:="=>#pole gaps =" -> =>#pole gaps = | F11: of:=[.B11] -> 20
C12: of:="=> Pole width/m =" -> => Pole width/m = | D12: of:= ([.D7] - [.F11] * [.B8] ) / [.B11] -> 0.0423598775598299 | E12: ← Note the pole height as high as possible because mostly the radial components contribute to the torque. → compromise: e.g. oval. Though if thinking of a generator then better circular to ease current induction?, see Lebowski's explanation endlesssphere.
A13: OR: (Attention, pole spacing not considered!! As it required iterating to solve.)
A14: Pole width/m = | B14: 0.05
C15: of:="=> Rotor Pole count =" -> => Rotor Pole count = | D15: of:= ([.D7] - [.F11] * [.B8] ) / [.B14] -> 16.943951023932 | E15: of:="=>#pole pairs =" -> =>#pole pairs = | F15: of:=[.D15]/2 -> 8.47197551196598
C16: Must be multiple of 2! (only pairs!)
A18: f_modulation / Hz = | B18: 20000
A19: f_AC_max / Hz = | B19: 75 | C19: of:="=>Revolutions/s =" -> =>Revolutions/s = | D19: of:=[.B19] / [.D$11] -> 7.5 | E19: <=> Rpm_max = | F19: of:=[.D19] * 60 -> 450
A20: f_AC_target / Hz = | B20: 50 | C20: of:="=>Revolutions/s =" -> =>Revolutions/s = | D20: of:=[.B20] / [.D$11] -> 5 | E20: <=> Rpm = | F20: of:=[.D20] * 60 -> 300
A21: f_AC_min / Hz = | B21: 25 | C21: of:="=>Revolutions/s =" -> =>Revolutions/s = | D21: of:=[.B21] / [.D$11] -> 2.5 | E21: <=> Rpm_min = | F21: of:=[.D21] * 60 -> 150
A23: Stator:
A24: Stator winding/teeth count = | B24: 9 | C24: ← Only multiples of phase count! e.g. x * 3 if 3 phases!
A25: Stator thickness (windings flush) /m = | B25: 0.02 | C25: NOTE: The rotor magnets must be contained within the outer bounds of the stator windings to fully utilize the magnetic flux!
A26: EITHER:
A27: #Turns / Winding = | B27: 27
A28: #Parallel wound/ Multiplier = | B28: 2 | C28: of:="=> #Turns / Winding =" -> => #Turns / Winding = | D28: of:=[.B27]*[.B28] -> 54 | E28: of:="=> Voltage / V_DC =" -> => Voltage / V_DC =
C29: EITHER:
C30: Diameter_magnet_wire / m = | D30: 0.001 | E30: of:="=> Current / A =" -> => Current / A =
E31: of:="=> Volume used / m^3 =" -> => Volume used / m^3 = | G31: of:="=> Radius used / m =" -> => Radius used / m =
C32: OR:
C33: Calculate magnet wire diameter from space and current constraints.
A35: OR:
A36: Target voltage / V_DC = | B36: 700
A37: Target amperage / A = | B37: 10
C38: TODO if useful.

Sheet: Turbine
B2: Turbine- Specifi- cation: ← ← ← | | E2: Turbine- Lift-Specifi- cation: | → → → | F2: Is_Lift Enabled = | G2: 1
A3: Average Efficiency_Power | B3: 0.3 | E3: Depth_blade B =
E4: Reynold Re = | G4: v_relative depth_blade / viscosity_kinematic
A5: Ratio V_Rotorarmtip / V_Wind Tip Speed Ratio (TSR) | B5: 0.65 | C5: Diameter_rotor * PI * f / velocity_relative
A6: OR | B6: 0
A7: f_in_flow (by experiment) =
A8: Ratio V_Rotorarmtip / V_Wind Tip Speed Ratio (TSR) | B8: of:=IF([.B6]>0; [.B7]; [.B5]) -> 0.65 | C8: Note: TSR Tip speed ratio Depends on how much wind the turbine catches and transforms into kinetic Energy/impulse, i.e.speed via 1/2 m * speed ^2 (energy) or m * v (impulse). While not all energy can be caught (and shouldn't to get the wind out of the way of new wind influx) the turbine can still rotate quicker (5x for horizontal), depending on pitch angle of turbine blades..
A10: Diameter_Turbine / m = | B10: 1
A11: along axis Height / m = | B11: 2 | C11: ← required if is vertical = 1
A12: Is Vertical: | B12: 1 | C12: ← For vertical/crossflow/helical/... turbine, effective area = diameter * height. ← For horizontal turbine effective area = pi*r^2. Not respecting the propeller gaps.
A14: Efficiency_torque = | B14: of:=[.$B$3] / [.$B$8] -> 0.461538461538462

Sheet: Impulse
A3: For Pelton turbines there is no pressure gradient across the turbine, thus it's completely impulse driven. The water impulse m*v is fully exploited by reversing the velocity's vector direction.

Sheet: manipulator 6 axes
A1: 6 axes manipulator Worst case calculations | B1: Part | C1: Joint 0 (yaw) | D1: Link 0 (base-segment0) | E1: Joint 1 | F1: Link 1 | G1: Joint 2 | H1: Link 2 | I1: Joint 3 | J1: Link 3 | K1: Joint 4 | L1: Link 4 | M1: Joint 5 (wrist) | N1: Link 5 (tool)
A2: Parameter | B2: Unit
A3: The worst case for the weigth liftable is the longest extent of the arm, i.e. the linear straight, parallel to ground situation.
A4: Motor.torque_holding | B4: Nm | E4: 13
A5: Transmission rate | E5: 28
A6: Transmission.torque_holding | B6: Nm | E6: of:=[.E4]*[.E5] -> 364
A7: g | B7: m / (s * s) | C7: 9.805
A8: length | B8: m | C8: 0 | D8: 0 | E8: 0 | F8: 0.5 | G8: 0 | H8: 0.5 | I8: 0 | J8: 0.5 | K8: 0 | L8: 0.5 | M8: 0 | N8: 0
A9: length_to_hold | B9: m | C9: of:=SUM([.D8:.$N8]) -> 2 | D9: of:=SUM([.E8:.$N8]) -> 2 | E9: of:=SUM([.F8:.$N8]) -> 2 | F9: of:=SUM([.G8:.$N8]) -> 1.5 | G9: of:=SUM([.H8:.$N8]) -> 1.5 | H9: of:=SUM([.I8:.$N8]) -> 1 | I9: of:=SUM([.J8:.$N8]) -> 1 | J9: of:=SUM([.K8:.$N8]) -> 0.5 | K9: of:=SUM([.L8:.$N8]) -> 0.5 | L9: of:=SUM([.M8:.$N8]) -> 0 | M9: of:=SUM([.M8:.N8]) -> 0 | N9: of:=[.N8] -> 0
A10: weight | B10: Kg | E10: of:=5+1.241+0.086+0.147+0.13 -> 6.604 | F10: 2.5 | G10: of:=[.E10]/2 -> 3.302 | H10: 2 | I10: of:=[.G10]/2 -> 1.651 | J10: 1.5 | K10: of:=[.I10]/2 -> 0.8255 | L10: 1 | M10: of:=[.K10]/2 -> 0.41275 | N10: 0.5 | O10: TODO Parse all files, extract weight information from ls -l output file name and sum up to reflect gear exchanges immediately.
A11: weight_to_hold | B11: Kg | C11: of:=SUM([.D10:.$O10]) -> 20.29525 | D11: of:=SUM([.E10:.$O10]) -> 20.29525 | E11: of:=SUM([.F10:.$O10]) -> 13.69125 | F11: of:=SUM([.G10:.$O10]) -> 11.19125 | G11: of:=SUM([.H10:.$O10]) -> 7.88925 | H11: of:=SUM([.I10:.$O10]) -> 5.88925 | I11: of:=SUM([.J10:.$O10]) -> 4.23825 | J11: of:=SUM([.K10:.$O10]) -> 2.73825 | K11: of:=SUM([.L10:.$O10]) -> 1.91275 | L11: of:=SUM([.M10:.$O10]) -> 0.91275 | M11: of:=SUM([.N10:.$O10]) -> 0.5 | N11: of:=SUM([.O10:.$O10]) -> 0
A12: length_to_hold_point_weight | B12: m | C12: of:=([.$C9]-[.C9]-[.C8]/2) -> 0 | D12: of:=([.$C9]-[.D9]-[.D8]/2) -> 0 | E12: of:=([.$C9]-[.E9]-[.E8]/2) -> 0 | F12: of:=([.$C9]-[.F9]-[.F8]/2) -> 0.25 | G12: of:=([.$C9]-[.G9]-[.G8]/2) -> 0.5 | H12: of:=([.$C9]-[.H9]-[.H8]/2) -> 0.75 | I12: of:=([.$C9]-[.I9]-[.I8]/2) -> 1 | J12: of:=([.$C9]-[.J9]-[.J8]/2) -> 1.25 | K12: of:=([.$C9]-[.K9]-[.K8]/2) -> 1.5 | L12: of:=([.$C9]-[.L9]-[.L8]/2) -> 1.75 | M12: of:=([.$C9]-[.M9]-[.M8]/2) -> 2 | N12: of:=([.$C9]-[.N9]-[.N8]/2) -> 2
A13: force_to_hold_point_weight | B13: N | C13: of:=[.C10]*[.$C7] -> 0 | D13: of:=[.D10]*[.$C7] -> 0 | E13: of:=[.E10]*[.$C7] -> 64.75222 | F13: of:=[.F10]*[.$C7] -> 24.5125 | G13: of:=[.G10]*[.$C7] -> 32.37611 | H13: of:=[.H10]*[.$C7] -> 19.61 | I13: of:=[.I10]*[.$C7] -> 16.188055 | J13: of:=[.J10]*[.$C7] -> 14.7075 | K13: of:=[.K10]*[.$C7] -> 8.0940275 | L13: of:=[.L10]*[.$C7] -> 9.805 | M13: of:=[.M10]*[.$C7]+[.N13] -> 8.94951375 | N13: of:=[.N10]*[.$C7] -> 4.9025
A14: Torque = force * length_reference
A15: torque_to_hold_point_weight_integral | B15: Nm | C15: of:=[.C13]*[.C12] -> 0 | D15: of:=[.D13]*[.D12] -> 0 | E15: of:=[.E13]*[.E12] -> 0 | F15: of:=[.F13]*[.F12] -> 6.128125 | G15: of:=[.G13]*[.G12] -> 16.188055 | H15: of:=[.H13]*[.H12] -> 14.7075 | I15: of:=[.I13]*[.I12] -> 16.188055 | J15: of:=[.J13]*[.J12] -> 18.384375 | K15: of:=[.K13]*[.K12] -> 12.14104125 | L15: of:=[.L13]*[.L12] -> 17.15875 | M15: of:=[.M13]*[.M12] -> 17.8990275 | N15: of:=[.N13]*[.N12] -> 9.805
A16: torque_remaining_for_payload | B16: Nm | E16: of:=[.E6]-SUM([.E15:.$N15]) -> 235.40007125
A17: <=> force_payload = torque_remaining / length_to_payload | B17: N | E17: of:=[.E16]/[.E9] -> 117.700035625
A20: <=> force = weight_liftable * g
A21: <=> weight_liftable = force / g | B21: Kg | E21: of:=[.E17] / [.$C$7] -> 12.0040831845997